ticker,company,title,url,source,published_at,snippet,scraped_at,platform,text_for_analysis,published_date
JNJ,Johnson & Johnson,2 Dividend Stocks That Jim Cramer Wants Every Retiree to Own,https://247wallst.com/investing/2025/10/03/2-dividend-stocks-that-jim-cramer-wants-every-retiree-to-own/?.tsrc=rss,Yahoo Finance RSS,"Mon, 08 Dec 2025 19:10:25 +0000","Retirees and older individuals are among the biggest demographics who tune into Jim Cramer’s Mad Money show. You may disagree with Cramer’s investing methodology and critique his failures, but it’s undeniable that his opinions have sway. And when it comes to long-term dividend investing, those opinions have held up quite well. Cramer’s opinionated takes often ... 2 Dividend Stocks That Jim Cramer Wants Every Retiree to Own",2025-12-10T23:52:56.545990,Yahoo Finance,"2 Dividend Stocks That Jim Cramer Wants Every Retiree to Own Retirees and older individuals are among the biggest demographics who tune into Jim Cramer’s Mad Money show. You may disagree with Cramer’s investing methodology and critique his failures, but it’s undeniable that his opinions have sway. And when it comes to long-term dividend investing, those opinions have held up quite well. Cramer’s opinionated takes often ... 2 Dividend Stocks That Jim Cramer Wants Every Retiree to Own",
JNJ,Johnson & Johnson,"Can J&J Offset Stelara LOE, MedTech China and Legal Headwinds in 2026?",https://finance.yahoo.com/news/j-j-offset-stelara-loe-161000514.html?.tsrc=rss,Yahoo Finance RSS,"Mon, 08 Dec 2025 16:10:00 +0000","J&J faces Stelara losses, Medicare shifts, talc suits and China pressure, banking on new products and expects segment growth to stay on track.",2025-12-10T23:52:56.545994,Yahoo Finance,"Can J&J Offset Stelara LOE, MedTech China and Legal Headwinds in 2026? J&J faces Stelara losses, Medicare shifts, talc suits and China pressure, banking on new products and expects segment growth to stay on track.",
JNJ,Johnson & Johnson,Warren Buffett wouldn’t worry about cash if he retired with just $1M. Here’s why and how to copy his strategy,https://finance.yahoo.com/news/warren-buffett-wouldn-t-worry-160100129.html?.tsrc=rss,Yahoo Finance RSS,"Mon, 08 Dec 2025 16:01:00 +0000",Here's how you could copy the Oracle of Omaha in today's market.,2025-12-10T23:52:56.545996,Yahoo Finance,Warren Buffett wouldn’t worry about cash if he retired with just $1M. Here’s why and how to copy his strategy Here's how you could copy the Oracle of Omaha in today's market.,
JNJ,Johnson & Johnson,Berkshire Hathaway stock picker Todd Combs departs to lead new strategic investment group at JPMorgan,https://finance.yahoo.com/news/berkshire-hathaway-stock-picker-todd-combs-departs-to-lead-new-strategic-investment-group-at-jpmorgan-154015380.html?.tsrc=rss,Yahoo Finance RSS,"Mon, 08 Dec 2025 15:40:15 +0000",Berkshire Hathaway's big shake-up across its corporate structure will see its top stock picker depart for JPMorgan.,2025-12-10T23:52:56.546002,Yahoo Finance,Berkshire Hathaway stock picker Todd Combs departs to lead new strategic investment group at JPMorgan Berkshire Hathaway's big shake-up across its corporate structure will see its top stock picker depart for JPMorgan.,
JPM,JPMorgan Chase,"Why GE Vernova Stock Just Got a $1,000 Price Target from JPMorgan",https://finance.yahoo.com/m/021ad6a3-f600-3a3d-bd29-bc002e434225/why-ge-vernova-stock-just-got.html,Barrons.com,2025-12-10T16:13:00,,2025-12-10T23:52:49.897864,Yahoo Finance,"Why GE Vernova Stock Just Got a $1,000 Price Target from JPMorgan ",2025-12-10 16:13:00
JPM,JPMorgan Chase,"JPMorgan Hands $1,000 to Employees Who Earn Less Than $80,000",https://finance.yahoo.com/m/1a9bc592-14cd-3b23-b485-282c6e538de2/jpmorgan-hands-%241%2C000-to.html,Barrons.com,2025-12-10T15:17:00,,2025-12-10T23:52:49.897884,Yahoo Finance,"JPMorgan Hands $1,000 to Employees Who Earn Less Than $80,000 ",2025-12-10 15:17:00
JPM,JPMorgan Chase,PNC Financial's Arm to Offer Direct Bitcoin Access via Coinbase,https://finance.yahoo.com/news/pnc-financials-arm-offer-direct-181900815.html,Zacks,2025-12-10T13:19:00,,2025-12-10T23:52:49.897899,Yahoo Finance,PNC Financial's Arm to Offer Direct Bitcoin Access via Coinbase ,2025-12-10 13:19:00
JPM,JPMorgan Chase,JPMorgan Stock Slides on Warning of Steep 2026 Expense Growth,https://finance.yahoo.com/news/jpmorgan-stock-slides-warning-steep-180400774.html,Zacks,2025-12-10T13:04:00,,2025-12-10T23:52:49.897912,Yahoo Finance,JPMorgan Stock Slides on Warning of Steep 2026 Expense Growth ,2025-12-10 13:04:00
JPM,JPMorgan Chase,"Thematic ETFs surged in 2025, thanks in part to AI investors",https://finance.yahoo.com/video/thematic-etfs-surged-2025-thanks-161803692.html,Yahoo Finance Video,2025-12-10T11:18:03,,2025-12-10T23:52:49.897925,Yahoo Finance,"Thematic ETFs surged in 2025, thanks in part to AI investors ",2025-12-10 11:18:03
JPM,JPMorgan Chase,3 Reasons why Berkshire Hathaway Looks Like a Buy Before January 1,https://finance.yahoo.com/m/59031fa4-a065-3d4b-9a10-dcc50862663f/3-reasons-why-berkshire.html,24/7 Wall St.,2025-12-10T10:21:03,,2025-12-10T23:52:49.897937,Yahoo Finance,3 Reasons why Berkshire Hathaway Looks Like a Buy Before January 1 ,2025-12-10 10:21:03
JPM,JPMorgan Chase,Looking at the Narrative for Standard Chartered After Mixed Analyst Target Revisions,https://finance.yahoo.com/news/looking-narrative-standard-chartered-mixed-150732030.html,Simply Wall St.,2025-12-10T10:07:32,,2025-12-10T23:52:49.897949,Yahoo Finance,Looking at the Narrative for Standard Chartered After Mixed Analyst Target Revisions ,2025-12-10 10:07:32
JPM,JPMorgan Chase,"Stock Market News for Dec 10, 2025",https://finance.yahoo.com/news/stock-market-news-dec-10-142100865.html,Zacks,2025-12-10T09:21:00,,2025-12-10T23:52:49.897960,Yahoo Finance,"Stock Market News for Dec 10, 2025 ",2025-12-10 09:21:00
JPM,JPMorgan Chase,"Social Buzz: Wallstreetbets Stocks Mostly Advancing Premarket Wednesday; Tesla, Strategy to Open Higher",https://finance.yahoo.com/news/social-buzz-wallstreetbets-stocks-mostly-114410434.html,MT Newswires,2025-12-10T06:44:10,,2025-12-10T23:52:49.897972,Yahoo Finance,"Social Buzz: Wallstreetbets Stocks Mostly Advancing Premarket Wednesday; Tesla, Strategy to Open Higher ",2025-12-10 06:44:10
JPM,JPMorgan Chase,"Why GE Vernova Stock Just Got a $1,000 Price Target from JPMorgan",https://finance.yahoo.com/m/021ad6a3-f600-3a3d-bd29-bc002e434225/why-ge-vernova-stock-just-got.html?.tsrc=rss,Yahoo Finance RSS,"Wed, 10 Dec 2025 21:13:00 +0000","When it comes to GE Vernova stock, investors believe. JPMorgan believes so much that it raised its price target to $1,000. Wall Street success, of course, is a little different from business success.",2025-12-10T23:52:50.216904,Yahoo Finance,"Why GE Vernova Stock Just Got a $1,000 Price Target from JPMorgan When it comes to GE Vernova stock, investors believe. JPMorgan believes so much that it raised its price target to $1,000. Wall Street success, of course, is a little different from business success.",
JPM,JPMorgan Chase,"JPMorgan Hands $1,000 to Employees Who Earn Less Than $80,000",https://finance.yahoo.com/m/1a9bc592-14cd-3b23-b485-282c6e538de2/jpmorgan-hands-%241%2C000-to.html?.tsrc=rss,Yahoo Finance RSS,"Wed, 10 Dec 2025 20:17:00 +0000","JPMorgan Chase is giving a payment of up to $1,000 to employees whose annual pay is less than $80,000, many of whom will receive it in the form of a contribution to JPMorgan retirement plans, Chief Executive Officer Jamie Dimon said in a staff memo on Tuesday. Employees qualify for the payment if they participate in the bank’s U.S. 401(k) plan, if they have worked there for at least one year, if their title is vice president or below, and if their total compensation is less than $80,000, according to a copy of the memo reviewed by Barron’s. Employees outside the U.S. will get a cash payment instead of a 401(k) contribution, the memo said.",2025-12-10T23:52:50.216907,Yahoo Finance,"JPMorgan Hands $1,000 to Employees Who Earn Less Than $80,000 JPMorgan Chase is giving a payment of up to $1,000 to employees whose annual pay is less than $80,000, many of whom will receive it in the form of a contribution to JPMorgan retirement plans, Chief Executive Officer Jamie Dimon said in a staff memo on Tuesday. Employees qualify for the payment if they participate in the bank’s U.S. 401(k) plan, if they have worked there for at least one year, if their title is vice president or below, and if their total compensation is less than $80,000, according to a copy of the memo reviewed by Barron’s. Employees outside the U.S. will get a cash payment instead of a 401(k) contribution, the memo said.",
JPM,JPMorgan Chase,PNC Financial's Arm to Offer Direct Bitcoin Access via Coinbase,https://finance.yahoo.com/news/pnc-financials-arm-offer-direct-181900815.html?.tsrc=rss,Yahoo Finance RSS,"Wed, 10 Dec 2025 18:19:00 +0000","PNC's arm rolls out direct bitcoin trading for private-wealthy clients, powered by Coinbase's CaaS to deliver integrated, on-platform digital-asset access.",2025-12-10T23:52:50.216910,Yahoo Finance,"PNC Financial's Arm to Offer Direct Bitcoin Access via Coinbase PNC's arm rolls out direct bitcoin trading for private-wealthy clients, powered by Coinbase's CaaS to deliver integrated, on-platform digital-asset access.",
JPM,JPMorgan Chase,JPMorgan Stock Slides on Warning of Steep 2026 Expense Growth,https://finance.yahoo.com/news/jpmorgan-stock-slides-warning-steep-180400774.html?.tsrc=rss,Yahoo Finance RSS,"Wed, 10 Dec 2025 18:04:00 +0000","JPM shares slide after the bank warns that 2026 expenses may surge more than $9B on growth spending, tech investments and inflation pressures.",2025-12-10T23:52:50.216913,Yahoo Finance,"JPMorgan Stock Slides on Warning of Steep 2026 Expense Growth JPM shares slide after the bank warns that 2026 expenses may surge more than $9B on growth spending, tech investments and inflation pressures.",
JPM,JPMorgan Chase,"Thematic ETFs surged in 2025, thanks in part to AI investors",https://finance.yahoo.com/video/thematic-etfs-surged-2025-thanks-161803692.html?.tsrc=rss,Yahoo Finance RSS,"Wed, 10 Dec 2025 16:18:03 +0000","Thematic ETFs investing is growing in popularity with total assets under management (AUM) rising to $188 billion. As part of this week's ETF Report, J.P. Morgan Asset Management Chief ETF Strategist Jon Maier joins Julie Hyman for a conversation on the rise of specific thematic ETFs, such as AI and robotics, and the emergence of actively managed ETFs, fixed-income funds, and 401(k) investing. J.P. Morgan manages its own US Tech Leaders ETF (JTEK), Hedged Equity Laddered Overlay ETF (HELO), and Active Bond ETF (JBND). To watch more expert insights and analysis on the latest market action, check out more Market Catalysts.",2025-12-10T23:52:50.216915,Yahoo Finance,"Thematic ETFs surged in 2025, thanks in part to AI investors Thematic ETFs investing is growing in popularity with total assets under management (AUM) rising to $188 billion. As part of this week's ETF Report, J.P. Morgan Asset Management Chief ETF Strategist Jon Maier joins Julie Hyman for a conversation on the rise of specific thematic ETFs, such as AI and robotics, and the emergence of actively managed ETFs, fixed-income funds, and 401(k) investing. J.P. Morgan manages its own US Tech Leaders ETF (JTEK), Hedged Equity Laddered Overlay ETF (HELO), and Active Bond ETF (JBND). To watch more expert insights and analysis on the latest market action, check out more Market Catalysts.",
JPM,JPMorgan Chase,3 Reasons why Berkshire Hathaway Looks Like a Buy Before January 1,https://247wallst.com/investing/2025/12/10/3-reasons-why-berkshire-hathaway-looks-like-a-buy-before-january-1/?.tsrc=rss,Yahoo Finance RSS,"Wed, 10 Dec 2025 15:21:03 +0000","Followers of Warren Buffett may bemoan is leave as CEO of Berkshire Hathaway (NYSE:BRK-B) at the end of this year. I know I will. But the reality is that over the decades, Buffett and his team have truly built a world-class company with exposure to some of the highest-quality assets that are about as recession-resistant as they ... 3 Reasons why Berkshire Hathaway Looks Like a Buy Before January 1",2025-12-10T23:52:50.216918,Yahoo Finance,"3 Reasons why Berkshire Hathaway Looks Like a Buy Before January 1 Followers of Warren Buffett may bemoan is leave as CEO of Berkshire Hathaway (NYSE:BRK-B) at the end of this year. I know I will. But the reality is that over the decades, Buffett and his team have truly built a world-class company with exposure to some of the highest-quality assets that are about as recession-resistant as they ... 3 Reasons why Berkshire Hathaway Looks Like a Buy Before January 1",
JPM,JPMorgan Chase,Looking at the Narrative for Standard Chartered After Mixed Analyst Target Revisions,https://finance.yahoo.com/news/looking-narrative-standard-chartered-mixed-150732030.html?.tsrc=rss,Yahoo Finance RSS,"Wed, 10 Dec 2025 15:07:32 +0000","Standard Chartered's latest valuation update nudges its fair value estimate slightly lower to about £16.18 per share, even as the underlying growth outlook remains broadly intact. With the discount rate and revenue growth assumptions essentially unchanged, the small adjustment largely reflects a more cautious interpretation of mixed analyst signals, balancing confidence in execution against lingering macro and profitability risks. Investors can track these subtle but important shifts in the...",2025-12-10T23:52:50.216921,Yahoo Finance,"Looking at the Narrative for Standard Chartered After Mixed Analyst Target Revisions Standard Chartered's latest valuation update nudges its fair value estimate slightly lower to about £16.18 per share, even as the underlying growth outlook remains broadly intact. With the discount rate and revenue growth assumptions essentially unchanged, the small adjustment largely reflects a more cautious interpretation of mixed analyst signals, balancing confidence in execution against lingering macro and profitability risks. Investors can track these subtle but important shifts in the...",
JPM,JPMorgan Chase,"Stock Market News for Dec 10, 2025",https://finance.yahoo.com/news/stock-market-news-dec-10-142100865.html?.tsrc=rss,Yahoo Finance RSS,"Wed, 10 Dec 2025 14:21:00 +0000","Wall Street closed mixed on Tuesday, pulled down by bank and healthcare stocks.",2025-12-10T23:52:50.216925,Yahoo Finance,"Stock Market News for Dec 10, 2025 Wall Street closed mixed on Tuesday, pulled down by bank and healthcare stocks.",
JPM,JPMorgan Chase,Stock Index Futures Muted Amid Caution Ahead of Fed Rate Decision,https://www.barchart.com/story/news/36546542/stock-index-futures-dip-amid-caution-ahead-of-fed-rate-decision?.tsrc=rss,Yahoo Finance RSS,"Wed, 10 Dec 2025 11:10:05 +0000","December S&P 500 E-Mini futures (ESZ25) are down -0.01%, and December Nasdaq 100 E-Mini futures (NQZ25) are down -0.05% this morning as investors refrain from making big bets ahead of the Federal Reserve’s final interest rate decision of the year, with all eyes on the central bank’s outlook for interest rates in 2026.",2025-12-10T23:52:50.216929,Yahoo Finance,"Stock Index Futures Muted Amid Caution Ahead of Fed Rate Decision December S&P 500 E-Mini futures (ESZ25) are down -0.01%, and December Nasdaq 100 E-Mini futures (NQZ25) are down -0.05% this morning as investors refrain from making big bets ahead of the Federal Reserve’s final interest rate decision of the year, with all eyes on the central bank’s outlook for interest rates in 2026.",
JPM,JPMorgan Chase,"The Zacks Analyst Blog Highlights JPMorgan Chase, EPAM Systems and Costco Wholesale",https://finance.yahoo.com/news/zacks-analyst-blog-highlights-jpmorgan-095000704.html?.tsrc=rss,Yahoo Finance RSS,"Wed, 10 Dec 2025 09:50:00 +0000","Steady NII growth at JPM, EPAM's digital-transformation momentum, and Costco's resilient membership model highlight how leaders across finance, tech services and retail are navigating 2026's shifting macro landscape.",2025-12-10T23:52:50.216931,Yahoo Finance,"The Zacks Analyst Blog Highlights JPMorgan Chase, EPAM Systems and Costco Wholesale Steady NII growth at JPM, EPAM's digital-transformation momentum, and Costco's resilient membership model highlight how leaders across finance, tech services and retail are navigating 2026's shifting macro landscape.",
JPM,JPMorgan Chase,How Recent Analyst Upgrades Are Reshaping The Fresnillo Investment Story,https://finance.yahoo.com/news/recent-analyst-upgrades-reshaping-fresnillo-050914983.html?.tsrc=rss,Yahoo Finance RSS,"Wed, 10 Dec 2025 05:09:14 +0000","Fresnillo's latest valuation update reflects only a modest trim to fair value and a slightly higher discount rate, even as analysts lean into stronger assumptions for revenue growth. Behind this, bullish houses are converging around upgraded commodity price forecasts and a more durable earnings cycle, while skeptics still flag execution and macro risks that could cap further re rating. Read on to see how this evolving mix of conviction and caution is reshaping the stock's story and how you...",2025-12-10T23:52:50.216934,Yahoo Finance,"How Recent Analyst Upgrades Are Reshaping The Fresnillo Investment Story Fresnillo's latest valuation update reflects only a modest trim to fair value and a slightly higher discount rate, even as analysts lean into stronger assumptions for revenue growth. Behind this, bullish houses are converging around upgraded commodity price forecasts and a more durable earnings cycle, while skeptics still flag execution and macro risks that could cap further re rating. Read on to see how this evolving mix of conviction and caution is reshaping the stock's story and how you...",
JPM,JPMorgan Chase,How Jamie Dimon lured a Warren Buffett protégé to JPMorgan,https://finance.yahoo.com/news/jamie-dimon-lured-warren-buffett-050024447.html?.tsrc=rss,Yahoo Finance RSS,"Wed, 10 Dec 2025 05:00:24 +0000","At a JPMorgan Chase event in November, Jamie Dimon and Todd Combs were catching up about the Wall Street bank’s recently announced initiative...",2025-12-10T23:52:50.216937,Yahoo Finance,"How Jamie Dimon lured a Warren Buffett protégé to JPMorgan At a JPMorgan Chase event in November, Jamie Dimon and Todd Combs were catching up about the Wall Street bank’s recently announced initiative...",
JPM,JPMorgan Chase,Review & Preview: Fed’s Big Finale,https://finance.yahoo.com/m/342351d6-5fbd-3ef6-863d-8b63398a8f2c/review-%26-preview%3A-fed%E2%80%99s-big.html?.tsrc=rss,Yahoo Finance RSS,"Wed, 10 Dec 2025 00:55:00 +0000","The moment Wall Street has spent the last six weeks waiting for has nearly arrived: The Federal Reserve will make its final interest-rate decision of the year at 2 p.m. ET tomorrow. Traders see an 87.4% chance that the Federal Open Market Committee will opt for a quarter-point cut, according to the CME FedWatch Tool. Such odds fell to about 30% in November but rebounded in the wake of dovish commentary from key central bank officials like New York Fed President John Williams.",2025-12-10T23:52:50.216940,Yahoo Finance,"Review & Preview: Fed’s Big Finale The moment Wall Street has spent the last six weeks waiting for has nearly arrived: The Federal Reserve will make its final interest-rate decision of the year at 2 p.m. ET tomorrow. Traders see an 87.4% chance that the Federal Open Market Committee will opt for a quarter-point cut, according to the CME FedWatch Tool. Such odds fell to about 30% in November but rebounded in the wake of dovish commentary from key central bank officials like New York Fed President John Williams.",
JPM,JPMorgan Chase,JPMorgan Stock Drops After Bank Predicts $105 Billion in Expenses Next Year,https://finance.yahoo.com/m/83021c17-a43f-37ac-8829-6beb9fd4f7b5/jpmorgan-stock-drops-after.html?.tsrc=rss,Yahoo Finance RSS,"Tue, 09 Dec 2025 21:51:53 +0000","JPMorgan Chase’s stock fell more than 4.7% on Tuesday after the bank told investors that it will spend billions of dollars more in expenses next year. At the Goldman Sachs conference in New York on Tuesday, consumer chief Marianne Lake told investors that the bank had just completed budgeting for next year and is planning to spend $105 billion, largely because of higher costs in her division. The bank is expecting expenses this year to be $95.9 billion and analysts had anticipated approximately $101 billion of expenses next year, according to FactSet.",2025-12-10T23:52:50.216943,Yahoo Finance,"JPMorgan Stock Drops After Bank Predicts $105 Billion in Expenses Next Year JPMorgan Chase’s stock fell more than 4.7% on Tuesday after the bank told investors that it will spend billions of dollars more in expenses next year. At the Goldman Sachs conference in New York on Tuesday, consumer chief Marianne Lake told investors that the bank had just completed budgeting for next year and is planning to spend $105 billion, largely because of higher costs in her division. The bank is expecting expenses this year to be $95.9 billion and analysts had anticipated approximately $101 billion of expenses next year, according to FactSet.",
JPM,JPMorgan Chase,JPMorgan’s Stock Slide Weighs on Dow Industrials,https://finance.yahoo.com/m/136ba97f-a41d-34c4-945e-e9963a476e9d/jpmorgan%E2%80%99s-stock-slide-weighs.html?.tsrc=rss,Yahoo Finance RSS,"Tue, 09 Dec 2025 21:43:00 +0000","The blue-chip index fell 0.4%, dragged down by JPMorgan Chase shares, ahead of the Fed’s rate decision. The S&P 500 slipped 0.1%, while the Nasdaq added 0.1%.",2025-12-10T23:52:50.216946,Yahoo Finance,"JPMorgan’s Stock Slide Weighs on Dow Industrials The blue-chip index fell 0.4%, dragged down by JPMorgan Chase shares, ahead of the Fed’s rate decision. The S&P 500 slipped 0.1%, while the Nasdaq added 0.1%.",
JPM,JPMorgan Chase,"Top Analyst Reports for JPMorgan Chase, EPAM & Costco",https://finance.yahoo.com/news/top-analyst-reports-jpmorgan-chase-213300661.html?.tsrc=rss,Yahoo Finance RSS,"Tue, 09 Dec 2025 21:33:00 +0000","New analyst reports spotlight JPMorgan Chase as operational strength, NII prospects and cost pressures shape its outlook.",2025-12-10T23:52:50.216948,Yahoo Finance,"Top Analyst Reports for JPMorgan Chase, EPAM & Costco New analyst reports spotlight JPMorgan Chase as operational strength, NII prospects and cost pressures shape its outlook.",
JPM,JPMorgan Chase,JPMorganChase Declares Common Stock Dividend,https://finance.yahoo.com/news/jpmorganchase-declares-common-stock-dividend-213100022.html?.tsrc=rss,Yahoo Finance RSS,"Tue, 09 Dec 2025 21:31:00 +0000","NEW YORK, December 09, 2025--JPMorgan Chase & Co. (NYSE: JPM) (""JPMorganChase"" or the ""Firm"") declared a quarterly dividend on the outstanding shares of the common stock of JPMorganChase. Information can be found on the Firm’s Investor Relations website at https://www.jpmorganchase.com/ir/news.",2025-12-10T23:52:50.216952,Yahoo Finance,"JPMorganChase Declares Common Stock Dividend NEW YORK, December 09, 2025--JPMorgan Chase & Co. (NYSE: JPM) (""JPMorganChase"" or the ""Firm"") declared a quarterly dividend on the outstanding shares of the common stock of JPMorganChase. Information can be found on the Firm’s Investor Relations website at https://www.jpmorganchase.com/ir/news.",
JPM,JPMorgan Chase,JPMorgan Stock Sinks on Higher Expense Outlook. Other Banks May Have to Keep Up.,https://finance.yahoo.com/m/3b5e4493-24c7-3e09-a6ae-c82d529da162/jpmorgan-stock-sinks-on.html?.tsrc=rss,Yahoo Finance RSS,"Tue, 09 Dec 2025 21:12:00 +0000","The nation’s largest bank said new growth initiatives, plus inflation, would driving expenses higher in 2026.",2025-12-10T23:52:50.216954,Yahoo Finance,"JPMorgan Stock Sinks on Higher Expense Outlook. Other Banks May Have to Keep Up. The nation’s largest bank said new growth initiatives, plus inflation, would driving expenses higher in 2026.",
JPM,JPMorgan Chase,"JPMorgan expects to spend $105B in 2026, Exxon lifts oil target",https://finance.yahoo.com/video/jpmorgan-expects-spend-105b-2026-210007233.html?.tsrc=rss,Yahoo Finance RSS,"Tue, 09 Dec 2025 21:00:07 +0000","Market Domination host Josh Lipton and Yahoo Finance senior reporter Brooke DiPalma track several of the day's top trending stock tickers, including JPMorgan Chase & Co. (JPM) releasing its 2026 spending forecasts, Exxon Mobil (XOM) lifting its growth targets in earnings, cash flow, and oil production (CL=F, BZ=F), and AutoZone (AZO) stock dropping after reporting a fiscal first quarter earnings miss. To watch more expert insights and analysis on the latest market action, check out more Market Domination.",2025-12-10T23:52:50.216957,Yahoo Finance,"JPMorgan expects to spend $105B in 2026, Exxon lifts oil target Market Domination host Josh Lipton and Yahoo Finance senior reporter Brooke DiPalma track several of the day's top trending stock tickers, including JPMorgan Chase & Co. (JPM) releasing its 2026 spending forecasts, Exxon Mobil (XOM) lifting its growth targets in earnings, cash flow, and oil production (CL=F, BZ=F), and AutoZone (AZO) stock dropping after reporting a fiscal first quarter earnings miss. To watch more expert insights and analysis on the latest market action, check out more Market Domination.",
KO,Coca-Cola Company,Coca-Cola names a company veteran as its new CEO,https://finance.yahoo.com/news/coca-cola-names-company-veteran-020110715.html,Associated Press Finance,2025-12-10T21:01:10,,2025-12-10T23:53:09.112747,Yahoo Finance,Coca-Cola names a company veteran as its new CEO ,2025-12-10 21:01:10
KO,Coca-Cola Company,Coca-Cola announces major leadership change as Henrique Braun is named next CEO,https://finance.yahoo.com/m/461fd5ba-e7a7-31fe-be20-3164e452e111/coca-cola-announces-major.html,Fox Business,2025-12-10T19:50:26,,2025-12-10T23:53:09.112758,Yahoo Finance,Coca-Cola announces major leadership change as Henrique Braun is named next CEO ,2025-12-10 19:50:26
