ticker,company,title,url,source,published_at,snippet,scraped_at,platform,text_for_analysis,published_date
NVDA,Nvidia,"Stock Market Today: Indexes Eye Record Highs On Fed Rate Cut, Powell's Comments; Palantir Jumps (Live Coverage)",https://finance.yahoo.com/m/d2a83895-3dec-3c32-978d-30d95c7a44de/stock-market-today%3A-indexes.html?.tsrc=rss,Yahoo Finance RSS,"Wed, 10 Dec 2025 21:32:13 +0000",Stock Market Today: The Dow Jones index rises Wednesday after the Fed rate cut. Microsoft stock sold off.,2025-12-10T23:52:38.301656,Yahoo Finance,"Stock Market Today: Indexes Eye Record Highs On Fed Rate Cut, Powell's Comments; Palantir Jumps (Live Coverage) Stock Market Today: The Dow Jones index rises Wednesday after the Fed rate cut. Microsoft stock sold off.",
ORCL,Oracle Corporation,Oracle Credit Risk Gauge Deteriorates After Earnings Report,https://finance.yahoo.com/news/oracle-credit-risk-gauge-deteriorates-234104211.html,Bloomberg,2025-12-10T18:41:04,,2025-12-10T23:52:52.986057,Yahoo Finance,Oracle Credit Risk Gauge Deteriorates After Earnings Report ,2025-12-10 18:41:04
ORCL,Oracle Corporation,Oracle ORCL Q2 2026 Earnings Call Transcript,https://finance.yahoo.com/m/f3be5363-32cc-37f4-b7fc-980c85cd5c57/oracle-orcl-q2-2026-earnings.html,Motley Fool,2025-12-10T18:22:32,,2025-12-10T23:52:52.986106,Yahoo Finance,Oracle ORCL Q2 2026 Earnings Call Transcript ,2025-12-10 18:22:32
ORCL,Oracle Corporation,Oracle Shares Tumble as AI Spending Outruns Returns,https://finance.yahoo.com/m/14178e07-f467-3b0d-b366-97eb8432f0a2/oracle-shares-tumble-as-ai.html,The Wall Street Journal,2025-12-10T18:20:00,,2025-12-10T23:52:52.986118,Yahoo Finance,Oracle Shares Tumble as AI Spending Outruns Returns ,2025-12-10 18:20:00
ORCL,Oracle Corporation,Oracle Stock Tumbles Despite Earnings That Crushed Estimates. Here’s Why.,https://finance.yahoo.com/m/e8a42f18-17f5-38dc-b780-cfb043e79fc5/oracle-stock-tumbles-despite.html,Barrons.com,2025-12-10T18:13:00,,2025-12-10T23:52:52.986130,Yahoo Finance,Oracle Stock Tumbles Despite Earnings That Crushed Estimates. Here’s Why. ,2025-12-10 18:13:00
ORCL,Oracle Corporation,A Dovish Message Within a Hawkish Rate Cut,https://finance.yahoo.com/news/dovish-message-within-hawkish-rate-224200403.html,Zacks,2025-12-10T17:42:00,,2025-12-10T23:52:52.986142,Yahoo Finance,A Dovish Message Within a Hawkish Rate Cut ,2025-12-10 17:42:00
ORCL,Oracle Corporation,Oracle Credit Risk Gauge Deteriorates After Earnings Report,https://finance.yahoo.com/news/oracle-credit-risk-gauge-deteriorates-234104211.html?.tsrc=rss,Yahoo Finance RSS,"Wed, 10 Dec 2025 23:41:04 +0000","The cost of protecting the company’s debt against default for five years rose about 0.05 percentage point to around 1.246 percentage point a year, according to ICE Data Services. The gauge, which rises as investor confidence in the company’s credit quality falls, reached its highest level intraday since Thursday. Oracle credit derivatives have become a credit market barometer for AI risk.",2025-12-10T23:52:53.321635,Yahoo Finance,"Oracle Credit Risk Gauge Deteriorates After Earnings Report The cost of protecting the company’s debt against default for five years rose about 0.05 percentage point to around 1.246 percentage point a year, according to ICE Data Services. The gauge, which rises as investor confidence in the company’s credit quality falls, reached its highest level intraday since Thursday. Oracle credit derivatives have become a credit market barometer for AI risk.",
ORCL,Oracle Corporation,Oracle ORCL Q2 2026 Earnings Call Transcript,https://www.fool.com/earnings/call-transcripts/2025/12/10/oracle-orcl-q2-2026-earnings-call-transcript/?.tsrc=rss,Yahoo Finance RSS,"Wed, 10 Dec 2025 23:22:32 +0000","On the call today are Chairman and Chief Technology Officer, Lawrence Ellison, Chief Executive Officer, Mike Cecilia, Chief Executive Officer Clay McGork, and Principal Financial Officer, Doug Caring. A copy of the press release and financial tables, which includes a GAAP to non-GAAP reconciliation, other supplemental financial information, and a list of many customers who purchased Oracle Cloud Services or went live on Oracle Cloud recently, will be available from our Investor Relations website.",2025-12-10T23:52:53.321658,Yahoo Finance,"Oracle ORCL Q2 2026 Earnings Call Transcript On the call today are Chairman and Chief Technology Officer, Lawrence Ellison, Chief Executive Officer, Mike Cecilia, Chief Executive Officer Clay McGork, and Principal Financial Officer, Doug Caring. A copy of the press release and financial tables, which includes a GAAP to non-GAAP reconciliation, other supplemental financial information, and a list of many customers who purchased Oracle Cloud Services or went live on Oracle Cloud recently, will be available from our Investor Relations website.",
ORCL,Oracle Corporation,Oracle Shares Tumble as AI Spending Outruns Returns,https://finance.yahoo.com/m/14178e07-f467-3b0d-b366-97eb8432f0a2/oracle-shares-tumble-as-ai.html?.tsrc=rss,Yahoo Finance RSS,"Wed, 10 Dec 2025 23:20:00 +0000","The cloud-computing company’s revenue and operating income for the most recent financial quarter fell slightly short of analysts’ expectations, while the company raised its spending forecast, adding fuel to concerns over the timeline for turning the AI industry’s ravenous demand for computing capacity into profits. Oracle reported quarterly revenue of $16.1 billion, up 14% from a year earlier, with overall cloud revenue growing by 34%. Cloud infrastructure revenue, reflecting Oracle’s business from AI companies, was $4.1 billion, slightly lower than analyst expectations.",2025-12-10T23:52:53.321662,Yahoo Finance,"Oracle Shares Tumble as AI Spending Outruns Returns The cloud-computing company’s revenue and operating income for the most recent financial quarter fell slightly short of analysts’ expectations, while the company raised its spending forecast, adding fuel to concerns over the timeline for turning the AI industry’s ravenous demand for computing capacity into profits. Oracle reported quarterly revenue of $16.1 billion, up 14% from a year earlier, with overall cloud revenue growing by 34%. Cloud infrastructure revenue, reflecting Oracle’s business from AI companies, was $4.1 billion, slightly lower than analyst expectations.",
ORCL,Oracle Corporation,Oracle Stock Tumbles Despite Earnings That Crushed Estimates. Here’s Why.,https://finance.yahoo.com/m/e8a42f18-17f5-38dc-b780-cfb043e79fc5/oracle-stock-tumbles-despite.html?.tsrc=rss,Yahoo Finance RSS,"Wed, 10 Dec 2025 23:13:00 +0000","Oracle stock tumbled after the company reported second-quarter earnings that came in way above projections, and guidance that came in short of estimates.",2025-12-10T23:52:53.321665,Yahoo Finance,"Oracle Stock Tumbles Despite Earnings That Crushed Estimates. Here’s Why. Oracle stock tumbled after the company reported second-quarter earnings that came in way above projections, and guidance that came in short of estimates.",
ORCL,Oracle Corporation,A Dovish Message Within a Hawkish Rate Cut,https://finance.yahoo.com/news/dovish-message-within-hawkish-rate-224200403.html?.tsrc=rss,Yahoo Finance RSS,"Wed, 10 Dec 2025 22:42:00 +0000","Starting in two days, the Fed will be purchasing $40 billion in Treasury bills, maintaining its balance sheet with an ""ample level of reserves.""",2025-12-10T23:52:53.321668,Yahoo Finance,"A Dovish Message Within a Hawkish Rate Cut Starting in two days, the Fed will be purchasing $40 billion in Treasury bills, maintaining its balance sheet with an ""ample level of reserves.""",
ORCL,Oracle Corporation,Oracle (ORCL) Reports Q2 Earnings: What Key Metrics Have to Say,https://finance.yahoo.com/news/oracle-orcl-reports-q2-earnings-223002436.html?.tsrc=rss,Yahoo Finance RSS,"Wed, 10 Dec 2025 22:30:02 +0000","While the top- and bottom-line numbers for Oracle (ORCL) give a sense of how the business performed in the quarter ended November 2025, it could be worth looking at how some of its key metrics compare to Wall Street estimates and year-ago values.",2025-12-10T23:52:53.321672,Yahoo Finance,"Oracle (ORCL) Reports Q2 Earnings: What Key Metrics Have to Say While the top- and bottom-line numbers for Oracle (ORCL) give a sense of how the business performed in the quarter ended November 2025, it could be worth looking at how some of its key metrics compare to Wall Street estimates and year-ago values.",
ORCL,Oracle Corporation,Oracle Stock Slides As Mixed Results Fail To Shake AI Fears,https://finance.yahoo.com/m/dd0cbfdb-0237-3425-8090-147cd8d3c063/oracle-stock-slides-as-mixed.html?.tsrc=rss,Yahoo Finance RSS,"Wed, 10 Dec 2025 22:15:23 +0000",Oracle stock fell late Wednesday after the tech giant in the center of the AI debate reported mixed fiscal Q2 results.,2025-12-10T23:52:53.321678,Yahoo Finance,Oracle Stock Slides As Mixed Results Fail To Shake AI Fears Oracle stock fell late Wednesday after the tech giant in the center of the AI debate reported mixed fiscal Q2 results.,
ORCL,Oracle Corporation,Oracle (ORCL) Beats Q2 Earnings Estimates,https://finance.yahoo.com/news/oracle-orcl-beats-q2-earnings-221503488.html?.tsrc=rss,Yahoo Finance RSS,"Wed, 10 Dec 2025 22:15:03 +0000","Oracle (ORCL) delivered earnings and revenue surprises of +38.65% and -0.55%, respectively, for the quarter ended November 2025. Do the numbers hold clues to what lies ahead for the stock?",2025-12-10T23:52:53.321681,Yahoo Finance,"Oracle (ORCL) Beats Q2 Earnings Estimates Oracle (ORCL) delivered earnings and revenue surprises of +38.65% and -0.55%, respectively, for the quarter ended November 2025. Do the numbers hold clues to what lies ahead for the stock?",
ORCL,Oracle Corporation,Oracle slumps in afterhours trading as Q2 revenue miss estimates on software drag,https://finance.yahoo.com/news/oracle-slumps-afterhours-trading-q2-220103839.html?.tsrc=rss,Yahoo Finance RSS,"Wed, 10 Dec 2025 22:01:03 +0000",Investing.com - Shares in Oracle fell in afterhours trading Wednesday after the computing group reported fiscal second-quarter revenue that missed expectations amid weakness in its software business.,2025-12-10T23:52:53.321684,Yahoo Finance,Oracle slumps in afterhours trading as Q2 revenue miss estimates on software drag Investing.com - Shares in Oracle fell in afterhours trading Wednesday after the computing group reported fiscal second-quarter revenue that missed expectations amid weakness in its software business.,
ORCL,Oracle Corporation,"Oracle's Q2 disappointed investors, but this analyst isn't worried",https://finance.yahoo.com/video/oracles-q2-disappointed-investors-analyst-214611125.html?.tsrc=rss,Yahoo Finance RSS,"Wed, 10 Dec 2025 21:46:11 +0000","Oracle's (ORCL) second quarter earnings results disappointed investors, missing estimates for adjusted revenue. The company did, however, beat estimates on adjusted earnings per share (EPS). Futurum CEO Daniel Newman joins Market Domination Overtime host Josh Lipton to discuss the earnings print. To watch more expert insights and analysis on the latest market action, check out more Market Domination Overtime.",2025-12-10T23:52:53.321694,Yahoo Finance,"Oracle's Q2 disappointed investors, but this analyst isn't worried Oracle's (ORCL) second quarter earnings results disappointed investors, missing estimates for adjusted revenue. The company did, however, beat estimates on adjusted earnings per share (EPS). Futurum CEO Daniel Newman joins Market Domination Overtime host Josh Lipton to discuss the earnings print. To watch more expert insights and analysis on the latest market action, check out more Market Domination Overtime.",
ORCL,Oracle Corporation,"Oracle (NYSE:ORCL) Misses Q4 CY2025 Revenue Estimates, Stock Drops",https://finance.yahoo.com/news/oracle-nyse-orcl-misses-q4-211904928.html?.tsrc=rss,Yahoo Finance RSS,"Wed, 10 Dec 2025 21:19:04 +0000","Enterprise software giant Oracle (NYSE:ORCL) missed Wall Street’s revenue expectations in Q4 CY2025, but sales rose 14.2% year on year to $16.06 billion. Its non-GAAP profit of $2.26 per share was 38% above analysts’ consensus estimates.",2025-12-10T23:52:53.321700,Yahoo Finance,"Oracle (NYSE:ORCL) Misses Q4 CY2025 Revenue Estimates, Stock Drops Enterprise software giant Oracle (NYSE:ORCL) missed Wall Street’s revenue expectations in Q4 CY2025, but sales rose 14.2% year on year to $16.06 billion. Its non-GAAP profit of $2.26 per share was 38% above analysts’ consensus estimates.",
PG,Procter & Gamble,Can Procter & Gamble's $15B Shareholder Return Offset Tariff Headwinds?,https://finance.yahoo.com/news/procter-gambles-15b-shareholder-return-185100794.html,Zacks,2025-12-10T13:51:00,,2025-12-10T23:53:04.876838,Yahoo Finance,Can Procter & Gamble's $15B Shareholder Return Offset Tariff Headwinds? ,2025-12-10 13:51:00
PG,Procter & Gamble,Procter & Gamble Drops 11.9% in 3 Months: Buy the Dip or Stay Wary?,https://finance.yahoo.com/news/procter-gamble-drops-11-9-180200118.html,Zacks,2025-12-10T13:02:00,,2025-12-10T23:53:04.876852,Yahoo Finance,Procter & Gamble Drops 11.9% in 3 Months: Buy the Dip or Stay Wary? ,2025-12-10 13:02:00
PG,Procter & Gamble,"Procter & Gamble (PG) valuation check as restructuring, CEO transition and new product pushes reshape investor expectations",https://finance.yahoo.com/news/procter-gamble-pg-valuation-check-231346141.html,Simply Wall St.,2025-12-09T18:13:46,,2025-12-10T23:53:04.876865,Yahoo Finance,"Procter & Gamble (PG) valuation check as restructuring, CEO transition and new product pushes reshape investor expectations ",2025-12-09 18:13:46
PG,Procter & Gamble,Premium Guard Inc. Announces Licensing Partnership with Procter & Gamble to Launch Febreze™ Cabin Air Filters,https://finance.yahoo.com/news/premium-guard-inc-announces-licensing-140200605.html,PR Newswire,2025-12-09T09:02:00,,2025-12-10T23:53:04.876877,Yahoo Finance,Premium Guard Inc. Announces Licensing Partnership with Procter & Gamble to Launch Febreze™ Cabin Air Filters ,2025-12-09 09:02:00
PG,Procter & Gamble,Stock Market Today: Dow Falls As Trump Says This; Warren Buffett's Berkshire Tests Key Level (Live Coverage),https://finance.yahoo.com/m/3120bd0b-4a07-3bdc-82f2-73f9cacc2a56/stock-market-today%3A-dow-falls.html,Investor's Business Daily,2025-12-08T16:45:46,,2025-12-10T23:53:04.876890,Yahoo Finance,Stock Market Today: Dow Falls As Trump Says This; Warren Buffett's Berkshire Tests Key Level (Live Coverage) ,2025-12-08 16:45:46
PG,Procter & Gamble,Why 2026 Could Be the Breakout Year for Dividend Growth Investors,https://finance.yahoo.com/m/5d929e32-df25-310f-8451-a936fa47e5d9/why-2026-could-be-the.html,24/7 Wall St.,2025-12-08T14:10:37,,2025-12-10T23:53:04.876902,Yahoo Finance,Why 2026 Could Be the Breakout Year for Dividend Growth Investors ,2025-12-08 14:10:37
PG,Procter & Gamble,Kimberly-Clark Progresses Toward Its Gross Margin Goal of 40%,https://finance.yahoo.com/news/kimberly-clark-progresses-toward-gross-165100076.html,Zacks,2025-12-08T11:51:00,,2025-12-10T23:53:04.876914,Yahoo Finance,Kimberly-Clark Progresses Toward Its Gross Margin Goal of 40% ,2025-12-08 11:51:00
PG,Procter & Gamble,Tide Teams Up with Netflix’s Stranger Things 5 to Reimagine its 1987 Letters to Tide Campaign Featuring New Boosted Formula,https://finance.yahoo.com/news/tide-teams-netflix-stranger-things-150000025.html,Business Wire,2025-12-08T10:00:00,,2025-12-10T23:53:04.876926,Yahoo Finance,Tide Teams Up with Netflix’s Stranger Things 5 to Reimagine its 1987 Letters to Tide Campaign Featuring New Boosted Formula ,2025-12-08 10:00:00
PG,Procter & Gamble,"Deutsche Bank Adjusts Price Target on Procter & Gamble to $171 From $176, Maintains Buy Rating",https://finance.yahoo.com/news/deutsche-bank-adjusts-price-target-111455817.html,MT Newswires,2025-12-08T06:14:55,,2025-12-10T23:53:04.876938,Yahoo Finance,"Deutsche Bank Adjusts Price Target on Procter & Gamble to $171 From $176, Maintains Buy Rating ",2025-12-08 06:14:55
PG,Procter & Gamble,Can Procter & Gamble's $15B Shareholder Return Offset Tariff Headwinds?,https://finance.yahoo.com/news/procter-gambles-15b-shareholder-return-185100794.html?.tsrc=rss,Yahoo Finance RSS,"Wed, 10 Dec 2025 18:51:00 +0000","PG faces tariff pressures despite cost cuts and price hikes, while strong cash flow supports $15B in fiscal 2026 shareholder returns.",2025-12-10T23:53:05.189040,Yahoo Finance,"Can Procter & Gamble's $15B Shareholder Return Offset Tariff Headwinds? PG faces tariff pressures despite cost cuts and price hikes, while strong cash flow supports $15B in fiscal 2026 shareholder returns.",
PG,Procter & Gamble,Procter & Gamble Drops 11.9% in 3 Months: Buy the Dip or Stay Wary?,https://finance.yahoo.com/news/procter-gamble-drops-11-9-180200118.html?.tsrc=rss,Yahoo Finance RSS,"Wed, 10 Dec 2025 18:02:00 +0000","PG's slide to fresh lows underscores softening demand and fierce discounting, leaving investors debating whether its premium valuation still holds up.",2025-12-10T23:53:05.189046,Yahoo Finance,"Procter & Gamble Drops 11.9% in 3 Months: Buy the Dip or Stay Wary? PG's slide to fresh lows underscores softening demand and fierce discounting, leaving investors debating whether its premium valuation still holds up.",
PG,Procter & Gamble,"Procter & Gamble (PG) valuation check as restructuring, CEO transition and new product pushes reshape investor expectations",https://finance.yahoo.com/news/procter-gamble-pg-valuation-check-231346141.html?.tsrc=rss,Yahoo Finance RSS,"Tue, 09 Dec 2025 23:13:46 +0000","Procter & Gamble (PG) has a lot happening at once, from a sweeping restructuring and CEO change to splashy brand tie ups and a fresh Febreze product push, all while options activity heats up. See our latest analysis for Procter & Gamble. Even with the restructuring, brand partnerships, and dividend story in focus, the stock has been under pressure. The year to date share price return is negative 16.65 percent, and the five year total shareholder return is 15.4 percent. This suggests long term...",2025-12-10T23:53:05.189051,Yahoo Finance,"Procter & Gamble (PG) valuation check as restructuring, CEO transition and new product pushes reshape investor expectations Procter & Gamble (PG) has a lot happening at once, from a sweeping restructuring and CEO change to splashy brand tie ups and a fresh Febreze product push, all while options activity heats up. See our latest analysis for Procter & Gamble. Even with the restructuring, brand partnerships, and dividend story in focus, the stock has been under pressure. The year to date share price return is negative 16.65 percent, and the five year total shareholder return is 15.4 percent. This suggests long term...",
PG,Procter & Gamble,Premium Guard Inc. Announces Licensing Partnership with Procter & Gamble to Launch Febreze™ Cabin Air Filters,https://finance.yahoo.com/news/premium-guard-inc-announces-licensing-140200605.html?.tsrc=rss,Yahoo Finance RSS,"Tue, 09 Dec 2025 14:02:00 +0000","Premium Guard Inc. (PGI), a leading manufacturer and supplier of high-quality automotive filtration products, announced a new licensing agreement with Procter & Gamble (P&G) to develop, distribute and sell Febreze™ Cabin Air Filters powered by PUREFLOW® Air Filtration Technology — bringing to market the trusted brand equity of Febreze with PUREFLOW®'s proven performance to redefine vehicle interior air quality (ViAQ™).",2025-12-10T23:53:05.189058,Yahoo Finance,"Premium Guard Inc. Announces Licensing Partnership with Procter & Gamble to Launch Febreze™ Cabin Air Filters Premium Guard Inc. (PGI), a leading manufacturer and supplier of high-quality automotive filtration products, announced a new licensing agreement with Procter & Gamble (P&G) to develop, distribute and sell Febreze™ Cabin Air Filters powered by PUREFLOW® Air Filtration Technology — bringing to market the trusted brand equity of Febreze with PUREFLOW®'s proven performance to redefine vehicle interior air quality (ViAQ™).",
PG,Procter & Gamble,Stock Market Today: Dow Falls As Trump Says This; Warren Buffett's Berkshire Tests Key Level (Live Coverage),https://finance.yahoo.com/m/3120bd0b-4a07-3bdc-82f2-73f9cacc2a56/stock-market-today%3A-dow-falls.html?.tsrc=rss,Yahoo Finance RSS,"Mon, 08 Dec 2025 21:45:46 +0000",The Dow Jones index fell Monday. Warner Bros Discovery takeover drama continued on the stock market today. Nvidia rose on China H200 hopes.,2025-12-10T23:53:05.189062,Yahoo Finance,Stock Market Today: Dow Falls As Trump Says This; Warren Buffett's Berkshire Tests Key Level (Live Coverage) The Dow Jones index fell Monday. Warner Bros Discovery takeover drama continued on the stock market today. Nvidia rose on China H200 hopes.,
PG,Procter & Gamble,Kimberly-Clark Progresses Toward Its Gross Margin Goal of 40%,https://finance.yahoo.com/news/kimberly-clark-progresses-toward-gross-165100076.html?.tsrc=rss,Yahoo Finance RSS,"Mon, 08 Dec 2025 16:51:00 +0000",KMB's Q3 progress boosts confidence that it can hit its 40% gross margin goal sooner as mix gains and cost cuts strengthen profitability.,2025-12-10T23:53:05.189070,Yahoo Finance,Kimberly-Clark Progresses Toward Its Gross Margin Goal of 40% KMB's Q3 progress boosts confidence that it can hit its 40% gross margin goal sooner as mix gains and cost cuts strengthen profitability.,
PG,Procter & Gamble,Tide Teams Up with Netflix’s Stranger Things 5 to Reimagine its 1987 Letters to Tide Campaign Featuring New Boosted Formula,https://finance.yahoo.com/news/tide-teams-netflix-stranger-things-150000025.html?.tsrc=rss,Yahoo Finance RSS,"Mon, 08 Dec 2025 15:00:00 +0000","CINCINNATI, December 08, 2025--Tide®, America’s #1 trusted laundry detergent brand, is proud to announce its partnership with Netflix’s Stranger Things for the show’s highly anticipated fifth and final season. This collaboration celebrates the show’s most memorable looks - like Eleven’s pink dress and Dustin’s ‘Camp Know Where’ tee - with stain-induced scenes inspired by the show, like Demogorgon-goo and pizza grease, putting Tide’s most advanced formula yet to the test. The partnership is broug",2025-12-10T23:53:05.189074,Yahoo Finance,"Tide Teams Up with Netflix’s Stranger Things 5 to Reimagine its 1987 Letters to Tide Campaign Featuring New Boosted Formula CINCINNATI, December 08, 2025--Tide®, America’s #1 trusted laundry detergent brand, is proud to announce its partnership with Netflix’s Stranger Things for the show’s highly anticipated fifth and final season. This collaboration celebrates the show’s most memorable looks - like Eleven’s pink dress and Dustin’s ‘Camp Know Where’ tee - with stain-induced scenes inspired by the show, like Demogorgon-goo and pizza grease, putting Tide’s most advanced formula yet to the test. The partnership is broug",
PG,Procter & Gamble,How Good Has PG Stock Actually Been?,https://www.fool.com/investing/2025/12/06/how-good-procter-gamble-pg-stock-actually-been/?.tsrc=rss,Yahoo Finance RSS,"Sat, 06 Dec 2025 18:50:00 +0000","Procter & Gamble's stock price is higher over the past five years, but investors would have done better with the S&P 500 or consumer staples ETFs.",2025-12-10T23:53:05.189092,Yahoo Finance,"How Good Has PG Stock Actually Been? Procter & Gamble's stock price is higher over the past five years, but investors would have done better with the S&P 500 or consumer staples ETFs.",
PG,Procter & Gamble,Is Procter & Gamble Now a Value Opportunity After the 2025 Share Price Pullback?,https://finance.yahoo.com/news/procter-gamble-now-value-opportunity-091116643.html?.tsrc=rss,Yahoo Finance RSS,"Sat, 06 Dec 2025 09:11:16 +0000","If you are wondering if Procter & Gamble is quietly turning into a value opportunity, or if the market is right to cool on this consumer staples giant, this article will walk you through the numbers in plain English. The stock has slipped recently, with the share price down 3.2% over the last week and 13.6% year to date, even though long term holders are still sitting on gains of 19.1% over five years. That pullback has come as investors reassess steady, defensive names in a market that has...",2025-12-10T23:53:05.189097,Yahoo Finance,"Is Procter & Gamble Now a Value Opportunity After the 2025 Share Price Pullback? If you are wondering if Procter & Gamble is quietly turning into a value opportunity, or if the market is right to cool on this consumer staples giant, this article will walk you through the numbers in plain English. The stock has slipped recently, with the share price down 3.2% over the last week and 13.6% year to date, even though long term holders are still sitting on gains of 19.1% over five years. That pullback has come as investors reassess steady, defensive names in a market that has...",
PG,Procter & Gamble,Procter & Gamble (PG) Stock Drops Despite Market Gains: Important Facts to Note,https://finance.yahoo.com/news/procter-gamble-pg-stock-drops-225002680.html?.tsrc=rss,Yahoo Finance RSS,"Fri, 05 Dec 2025 22:50:02 +0000","Procter & Gamble (PG) reached $143.45 at the closing of the latest trading day, reflecting a -1.31% change compared to its last close.",2025-12-10T23:53:05.189102,Yahoo Finance,"Procter & Gamble (PG) Stock Drops Despite Market Gains: Important Facts to Note Procter & Gamble (PG) reached $143.45 at the closing of the latest trading day, reflecting a -1.31% change compared to its last close.",
PG,Procter & Gamble,Dollar Tree Stock Will Go a Lot Further Than a Buck,https://finance.yahoo.com/m/733feced-ab1e-3634-a79e-ba490f8dfc96/dollar-tree-stock-will-go-a.html?.tsrc=rss,Yahoo Finance RSS,"Fri, 05 Dec 2025 16:05:00 +0000",Inflation and tariffs have made it near impossible for discount chains to sell many items for $1 or less. It hasn’t mattered.,2025-12-10T23:53:05.189106,Yahoo Finance,Dollar Tree Stock Will Go a Lot Further Than a Buck Inflation and tariffs have made it near impossible for discount chains to sell many items for $1 or less. It hasn’t mattered.,
