ticker,company,title,url,source,published_at,snippet,scraped_at,platform,text_for_analysis,published_date
BAC,Bank of America,"If You Invested $10K In Bank of America Stock 10 Years Ago, How Much Would You Have Now?",https://finance.yahoo.com/news/invested-10k-bank-america-stock-130053064.html?.tsrc=rss,Yahoo Finance RSS,"Sat, 06 Dec 2025 13:00:53 +0000","Bank of America Corp. (NYSE:BAC) is a major global financial institution providing a wide range of banking, investment management, and financial products and services to individuals, small- and middle-market businesses, large corporations, and ...",2025-12-10T23:53:03.068179,Yahoo Finance,"If You Invested $10K In Bank of America Stock 10 Years Ago, How Much Would You Have Now? Bank of America Corp. (NYSE:BAC) is a major global financial institution providing a wide range of banking, investment management, and financial products and services to individuals, small- and middle-market businesses, large corporations, and ...",
BAC,Bank of America,How to talk to your family about the economy over the holidays,https://finance.yahoo.com/news/talk-family-economy-over-holidays-093822595.html?.tsrc=rss,Yahoo Finance RSS,"Sat, 06 Dec 2025 09:38:22 +0000","Investing.com -- Bank of America analyst ​​Aditya Bhave said in a note this week that the holiday table could be full of “cold weather [and] heated debates,” with families likely to ask pointed questions about inflation, housing, the labor market and the Federal Reserve.",2025-12-10T23:53:03.068182,Yahoo Finance,"How to talk to your family about the economy over the holidays Investing.com -- Bank of America analyst ​​Aditya Bhave said in a note this week that the holiday table could be full of “cold weather [and] heated debates,” with families likely to ask pointed questions about inflation, housing, the labor market and the Federal Reserve.",
BAC,Bank of America,Why Consumers May Keep Spending Despite Affordability Angst,https://finance.yahoo.com/m/825aaec8-bdd5-38d0-9c3b-ca1c3ac3c764/why-consumers-may-keep.html?.tsrc=rss,Yahoo Finance RSS,"Sat, 06 Dec 2025 07:30:00 +0000","While President Donald Trump this week called concern about the cost of living a “con job,” the strain American households are feeling is real.",2025-12-10T23:53:03.068185,Yahoo Finance,"Why Consumers May Keep Spending Despite Affordability Angst While President Donald Trump this week called concern about the cost of living a “con job,” the strain American households are feeling is real.",
BAC,Bank of America,"Top Research Reports for Bank of America, Salesforce & Pepsi",https://finance.yahoo.com/news/top-research-reports-bank-america-212900846.html?.tsrc=rss,Yahoo Finance RSS,"Fri, 05 Dec 2025 21:29:00 +0000","BAC's projected revenue gains, digital expansion and loan growth headline Zacks' top research reports today.",2025-12-10T23:53:03.068189,Yahoo Finance,"Top Research Reports for Bank of America, Salesforce & Pepsi BAC's projected revenue gains, digital expansion and loan growth headline Zacks' top research reports today.",
BAC,Bank of America,2025 A Year for Crypto: Can ETFs Surge in 2026?,https://finance.yahoo.com/news/2025-crypto-etfs-surge-2026-180000271.html?.tsrc=rss,Yahoo Finance RSS,"Fri, 05 Dec 2025 18:00:00 +0000","Cryptos slip after record highs. Will ETFs like BITB, FBTC, IBIT, ETHE, and FETH fuel the next crypto uptrend?",2025-12-10T23:53:03.068192,Yahoo Finance,"2025 A Year for Crypto: Can ETFs Surge in 2026? Cryptos slip after record highs. Will ETFs like BITB, FBTC, IBIT, ETHE, and FETH fuel the next crypto uptrend?",
BAC,Bank of America,Copper and Oil: Two Ways to Win if the Economy Runs Hot,https://finance.yahoo.com/m/8dfc026e-4dd9-3d2c-9afc-c9fa6231b707/copper-and-oil%3A-two-ways-to.html?.tsrc=rss,Yahoo Finance RSS,"Fri, 05 Dec 2025 17:50:00 +0000","Copper has momentum while oil is a contrarian bet on a recovery in 2026, according to Bank of America.",2025-12-10T23:53:03.068195,Yahoo Finance,"Copper and Oil: Two Ways to Win if the Economy Runs Hot Copper has momentum while oil is a contrarian bet on a recovery in 2026, according to Bank of America.",
BAC,Bank of America,Bank of America Shares Climb 23.1% YTD: Is It Too Late to Buy?,https://finance.yahoo.com/news/bank-america-shares-climb-23-142500288.html?.tsrc=rss,Yahoo Finance RSS,"Fri, 05 Dec 2025 14:25:00 +0000","BAC shares are up 23.1% YTD, yet with NII growth, $40B in buybacks and a tech-driven strategy, the stock still looks attractive.",2025-12-10T23:53:03.068199,Yahoo Finance,"Bank of America Shares Climb 23.1% YTD: Is It Too Late to Buy? BAC shares are up 23.1% YTD, yet with NII growth, $40B in buybacks and a tech-driven strategy, the stock still looks attractive.",
BRK.B,Berkshire Hathaway,"Want $3,500 per Year in Monthly Passive Income? Invest Just $2,500 in These Dividend Stocks",https://finance.yahoo.com/m/aaa1c7de-a8ec-37b9-9f84-396db51e766f/want-%243%2C500-per-year-in.html,24/7 Wall St.,2025-11-18T13:04:42,,2025-12-10T23:52:47.781572,Yahoo Finance,"Want $3,500 per Year in Monthly Passive Income? Invest Just $2,500 in These Dividend Stocks ",2025-11-18 13:04:42
BRK.B,Berkshire Hathaway,Bodor Laser Provides All-in-One Profile Cutting Solution for Structural Steel Fabrication,https://finance.yahoo.com/news/bodor-laser-provides-one-profile-045000631.html,GlobeNewswire,2025-12-10T23:50:00,,2025-12-10T23:52:48.015092,Yahoo Finance,Bodor Laser Provides All-in-One Profile Cutting Solution for Structural Steel Fabrication ,2025-12-10 23:50:00
BRK.B,Berkshire Hathaway,Rhinocare Korea Accelerates Global Expansion with Singapore Joint Venture,https://finance.yahoo.com/news/rhinocare-korea-accelerates-global-expansion-044600262.html,PR Newswire,2025-12-10T23:46:00,,2025-12-10T23:52:48.015110,Yahoo Finance,Rhinocare Korea Accelerates Global Expansion with Singapore Joint Venture ,2025-12-10 23:46:00
BRK.B,Berkshire Hathaway,High Growth Tech Stocks To Watch In Asia December 2025,https://finance.yahoo.com/news/high-growth-tech-stocks-watch-043819096.html,Simply Wall St.,2025-12-10T23:38:19,,2025-12-10T23:52:48.015125,Yahoo Finance,High Growth Tech Stocks To Watch In Asia December 2025 ,2025-12-10 23:38:19
BRK.B,Berkshire Hathaway,Asian Stocks Estimated Below Intrinsic Value In December 2025,https://finance.yahoo.com/news/asian-stocks-estimated-below-intrinsic-043754422.html,Simply Wall St.,2025-12-10T23:37:54,,2025-12-10T23:52:48.015138,Yahoo Finance,Asian Stocks Estimated Below Intrinsic Value In December 2025 ,2025-12-10 23:37:54
BRK.B,Berkshire Hathaway,Asian Growth Stocks With Strong Insider Ownership,https://finance.yahoo.com/news/asian-growth-stocks-strong-insider-043544734.html,Simply Wall St.,2025-12-10T23:35:44,,2025-12-10T23:52:48.015151,Yahoo Finance,Asian Growth Stocks With Strong Insider Ownership ,2025-12-10 23:35:44
BRK.B,Berkshire Hathaway,Investing in Koh Brothers Eco Engineering (Catalist:5HV) five years ago would have delivered you a 139% gain,https://finance.yahoo.com/news/investing-koh-brothers-eco-engineering-043447171.html,Simply Wall St.,2025-12-10T23:34:47,,2025-12-10T23:52:48.015164,Yahoo Finance,Investing in Koh Brothers Eco Engineering (Catalist:5HV) five years ago would have delivered you a 139% gain ,2025-12-10 23:34:47
BRK.B,Berkshire Hathaway,Exploring Tanwan And 2 Other Promising Small Caps In Asia,https://finance.yahoo.com/news/exploring-tanwan-2-other-promising-043316232.html,Simply Wall St.,2025-12-10T23:33:16,,2025-12-10T23:52:48.015176,Yahoo Finance,Exploring Tanwan And 2 Other Promising Small Caps In Asia ,2025-12-10 23:33:16
BRK.B,Berkshire Hathaway,Cracker Barrel takes McDonald's strategy to win back lost customers,https://finance.yahoo.com/m/6d5f9377-db5a-329d-9500-31d947db879d/cracker-barrel-takes.html,TheStreet,2025-12-10T23:33:00,,2025-12-10T23:52:48.015189,Yahoo Finance,Cracker Barrel takes McDonald's strategy to win back lost customers ,2025-12-10 23:33:00
BRK.B,Berkshire Hathaway,Asian Dividend Stocks To Enhance Your Portfolio,https://finance.yahoo.com/news/asian-dividend-stocks-enhance-portfolio-043150314.html,Simply Wall St.,2025-12-10T23:31:50,,2025-12-10T23:52:48.015202,Yahoo Finance,Asian Dividend Stocks To Enhance Your Portfolio ,2025-12-10 23:31:50
BRK.B,Berkshire Hathaway,'Big Short' Investor Michael Burry Says He's Learning About Tokenization And How It Is Rewiring Wall Street,https://finance.yahoo.com/news/big-short-investor-michael-burry-043039788.html,Benzinga,2025-12-10T23:30:39,,2025-12-10T23:52:48.015214,Yahoo Finance,'Big Short' Investor Michael Burry Says He's Learning About Tokenization And How It Is Rewiring Wall Street ,2025-12-10 23:30:39
COST,Costco,How Has Costco (COST) Stock Done for Investors?,https://finance.yahoo.com/m/ffb5552e-00c7-3ced-a401-ce6f3f7ec346/how-has-costco-%28cost%29-stock.html,Motley Fool,2025-12-10T20:41:00,,2025-12-10T23:53:00.532616,Yahoo Finance,How Has Costco (COST) Stock Done for Investors? ,2025-12-10 20:41:00
COST,Costco,Costco members voice major shopping complaint,https://finance.yahoo.com/m/e005d34a-1060-3bfd-9dd8-22aa5338a50f/costco-members-voice-major.html,TheStreet,2025-12-10T18:33:00,,2025-12-10T23:53:00.532666,Yahoo Finance,Costco members voice major shopping complaint ,2025-12-10 18:33:00
COST,Costco,"Costco suit sparks tariff refund FOMO, but it’s not the only relief route",https://finance.yahoo.com/m/9bf95ed2-21d2-3677-85dd-b2f0accca676/costco-suit-sparks-tariff.html,CFO Dive,2025-12-10T09:59:34,,2025-12-10T23:53:00.532700,Yahoo Finance,"Costco suit sparks tariff refund FOMO, but it’s not the only relief route ",2025-12-10 09:59:34
COST,Costco,Supreme Court Could Rule on Tariffs as Early as This Week. What to Know.,https://finance.yahoo.com/m/9029eae2-01b5-357c-96cd-e7a8ae9264d3/supreme-court-could-rule-on.html,Barrons.com,2025-12-10T09:49:00,,2025-12-10T23:53:00.532711,Yahoo Finance,Supreme Court Could Rule on Tariffs as Early as This Week. What to Know. ,2025-12-10 09:49:00
COST,Costco,How Has Costco (COST) Stock Done for Investors?,https://www.fool.com/investing/2025/12/10/how-has-costco-stock-done-for-investors/?.tsrc=rss,Yahoo Finance RSS,"Thu, 11 Dec 2025 01:41:00 +0000",Costco stock has stumbled lately -- but does that retreat tell the whole story? A closer examination of short- and long-term returns reveals a more nuanced picture.,2025-12-10T23:53:00.851766,Yahoo Finance,How Has Costco (COST) Stock Done for Investors? Costco stock has stumbled lately -- but does that retreat tell the whole story? A closer examination of short- and long-term returns reveals a more nuanced picture.,
COST,Costco,Costco members voice major shopping complaint,https://www.thestreet.com/retail/costco-members-voice-major-shopping-complaint?.tsrc=rss,Yahoo Finance RSS,"Wed, 10 Dec 2025 23:33:00 +0000","I'll never forget the first time I walked into a Costco warehouse. Once I got through the bottleneck at the entrance, I couldn't help but marvel at the sheer size of the store. Roughly two hours later, I emerged from Costco with a loaded shopping cart and a larger credit card bill than ...",2025-12-10T23:53:00.851810,Yahoo Finance,"Costco members voice major shopping complaint I'll never forget the first time I walked into a Costco warehouse. Once I got through the bottleneck at the entrance, I couldn't help but marvel at the sheer size of the store. Roughly two hours later, I emerged from Costco with a loaded shopping cart and a larger credit card bill than ...",
COST,Costco,"Costco suit sparks tariff refund FOMO, but it’s not the only relief route",https://www.cfodive.com/news/costco-suit-sparks-fomo-but-other-tariff-refund-strategies/807460/?.tsrc=rss,Yahoo Finance RSS,"Wed, 10 Dec 2025 14:59:34 +0000","Firms mulling similar litigation should “do their homework” and check deadlines for alternative and potentially less costly actions, trade attorney Doreen M. Edelman said.",2025-12-10T23:53:00.851830,Yahoo Finance,"Costco suit sparks tariff refund FOMO, but it’s not the only relief route Firms mulling similar litigation should “do their homework” and check deadlines for alternative and potentially less costly actions, trade attorney Doreen M. Edelman said.",
COST,Costco,Supreme Court Could Rule on Tariffs as Early as This Week. What to Know.,https://finance.yahoo.com/m/9029eae2-01b5-357c-96cd-e7a8ae9264d3/supreme-court-could-rule-on.html?.tsrc=rss,Yahoo Finance RSS,"Wed, 10 Dec 2025 14:49:00 +0000","A ruling against the administration would threaten the core of Trump’s trade policy, raise questions about the federal budget deficit, and might trigger payments to some big companies.",2025-12-10T23:53:00.851837,Yahoo Finance,"Supreme Court Could Rule on Tariffs as Early as This Week. What to Know. A ruling against the administration would threaten the core of Trump’s trade policy, raise questions about the federal budget deficit, and might trigger payments to some big companies.",
COST,Costco,Are Investors Undervaluing Costain Group PLC (LON:COST) By 50%?,https://finance.yahoo.com/news/investors-undervaluing-costain-group-plc-105517241.html?.tsrc=rss,Yahoo Finance RSS,"Wed, 10 Dec 2025 10:55:17 +0000",Key Insights The projected fair value for Costain Group is UK£3.14 based on 2 Stage Free Cash Flow to Equity Current...,2025-12-10T23:53:00.851850,Yahoo Finance,Are Investors Undervaluing Costain Group PLC (LON:COST) By 50%? Key Insights The projected fair value for Costain Group is UK£3.14 based on 2 Stage Free Cash Flow to Equity Current...,
COST,Costco,"Fed Rate Decision, Adobe and Oracle Earnings: Still to Come This Week",https://finance.yahoo.com/m/001ab591-77c1-35f0-b761-39cbeba14d37/fed-rate-decision%2C-adobe-and.html?.tsrc=rss,Yahoo Finance RSS,"Wed, 10 Dec 2025 07:58:30 +0000","The Federal Reserve will unveil its last rate-setting decision of 2025. A few notable earnings are also due, including Broadcom, Oracle and Adobe, plus retailer Costco. Here's what to expect: Today Earnings: Adobe, Oracle (🎧more on the AI trade), Synopsys, Vail Resorts Economic data: Monthly federal data on deficits/surpluses and delayed quarterly employment cost index Fed decision: The central bank is expected to cut rates by 0.",2025-12-10T23:53:00.851868,Yahoo Finance,"Fed Rate Decision, Adobe and Oracle Earnings: Still to Come This Week The Federal Reserve will unveil its last rate-setting decision of 2025. A few notable earnings are also due, including Broadcom, Oracle and Adobe, plus retailer Costco. Here's what to expect: Today Earnings: Adobe, Oracle (🎧more on the AI trade), Synopsys, Vail Resorts Economic data: Monthly federal data on deficits/surpluses and delayed quarterly employment cost index Fed decision: The central bank is expected to cut rates by 0.",
COST,Costco,Costco (COST) Q4 Earnings: What To Expect,https://finance.yahoo.com/news/costco-cost-q4-earnings-expect-030108301.html?.tsrc=rss,Yahoo Finance RSS,"Wed, 10 Dec 2025 03:01:08 +0000",Membership-only discount retailer Costco (NASDAQ:COST) will be reporting results this Thursday afternoon. Here’s what to look for.,2025-12-10T23:53:00.851875,Yahoo Finance,Costco (COST) Q4 Earnings: What To Expect Membership-only discount retailer Costco (NASDAQ:COST) will be reporting results this Thursday afternoon. Here’s what to look for.,
COST,Costco,"Stock market today: Dow slips as JPMorgan slides, S&P 500, Nasdaq little changed with all eyes on Fed decision",https://finance.yahoo.com/news/live/stock-market-today-dow-slips-as-jpmorgan-slides-sp-500-nasdaq-little-changed-with-all-eyes-on-fed-decision-210044915.html?.tsrc=rss,Yahoo Finance RSS,"Tue, 09 Dec 2025 21:00:44 +0000",Wall Street is looking to the Fed policy meeting starting today for clues to the odds of more rate cuts in 2026.,2025-12-10T23:53:00.851888,Yahoo Finance,"Stock market today: Dow slips as JPMorgan slides, S&P 500, Nasdaq little changed with all eyes on Fed decision Wall Street is looking to the Fed policy meeting starting today for clues to the odds of more rate cuts in 2026.",
COST,Costco,"Costco Shares May Benefit From Special Dividend, Stock Split, Oppenheimer Says",https://finance.yahoo.com/news/costco-shares-may-benefit-special-173547486.html?.tsrc=rss,Yahoo Finance RSS,"Tue, 09 Dec 2025 17:35:47 +0000",Costco Wholesale (COST) shares may benefit from potential catalysts such as a special dividend or st,2025-12-10T23:53:00.851895,Yahoo Finance,"Costco Shares May Benefit From Special Dividend, Stock Split, Oppenheimer Says Costco Wholesale (COST) shares may benefit from potential catalysts such as a special dividend or st",
COST,Costco,3 Stocks That Could Skyrocket Before the End of 2025,https://www.fool.com/investing/2025/12/09/3-stocks-that-could-skyrocket-before-the-end-2025/?.tsrc=rss,Yahoo Finance RSS,"Tue, 09 Dec 2025 16:25:00 +0000",All of these stocks have near-term catalysts as well as long-term opportunities.,2025-12-10T23:53:00.851901,Yahoo Finance,3 Stocks That Could Skyrocket Before the End of 2025 All of these stocks have near-term catalysts as well as long-term opportunities.,
CSCO,Cisco,"Bitcoin stays flat, small caps' rate-cut spike: Market takeaways",https://finance.yahoo.com/video/bitcoin-stays-flat-small-caps-230000741.html,Yahoo Finance Video,2025-12-10T18:00:00,,2025-12-10T23:53:08.063697,Yahoo Finance,"Bitcoin stays flat, small caps' rate-cut spike: Market takeaways ",2025-12-10 18:00:00
CSCO,Cisco,Cisco Shares Finally Top Dot-Com Record After More Than 25 Years,https://finance.yahoo.com/news/cisco-shares-finally-top-dot-210520258.html,Bloomberg,2025-12-10T16:05:20,,2025-12-10T23:53:08.063749,Yahoo Finance,Cisco Shares Finally Top Dot-Com Record After More Than 25 Years ,2025-12-10 16:05:20
CSCO,Cisco,Oracle's $520 Billion Cloud Dream Faces a Debt Nightmare,https://finance.yahoo.com/news/oracles-520-billion-cloud-dream-172205961.html,GuruFocus.com,2025-12-10T12:22:05,,2025-12-10T23:53:08.063762,Yahoo Finance,Oracle's $520 Billion Cloud Dream Faces a Debt Nightmare ,2025-12-10 12:22:05
CSCO,Cisco,Will NVIDIA (NVDA) Stock Hit $500 by 2030?,https://finance.yahoo.com/m/7630afb2-8e7d-327c-853f-8ea00a7b1909/will-nvidia-%28nvda%29-stock-hit.html,24/7 Wall St.,2025-12-10T10:18:03,,2025-12-10T23:53:08.063777,Yahoo Finance,Will NVIDIA (NVDA) Stock Hit $500 by 2030? ,2025-12-10 10:18:03
CSCO,Cisco,"Iron Bow Technologies Wins ""Partner for Purpose Award for Crisis Response & Human Needs Solution"" in Cisco's 2025 Global Partner Innovation Challenge",https://finance.yahoo.com/news/iron-bow-technologies-wins-partner-150000418.html,PR Newswire,2025-12-10T10:00:00,,2025-12-10T23:53:08.063791,Yahoo Finance,"Iron Bow Technologies Wins ""Partner for Purpose Award for Crisis Response & Human Needs Solution"" in Cisco's 2025 Global Partner Innovation Challenge ",2025-12-10 10:00:00
CSCO,Cisco,Cyber Resilience for All: How Cisco and NIIT Foundation Are Securing India's Digital Future,https://finance.yahoo.com/news/cyber-resilience-cisco-niit-foundation-141500771.html,ACCESS Newswire,2025-12-10T09:15:00,,2025-12-10T23:53:08.063804,Yahoo Finance,Cyber Resilience for All: How Cisco and NIIT Foundation Are Securing India's Digital Future ,2025-12-10 09:15:00
CSCO,Cisco,Prediction: IonQ Stock Will Be Worth This Much By Year-End 2026,https://finance.yahoo.com/m/6901c89d-252d-3acf-8904-481f52a318d3/prediction%3A-ionq-stock-will.html,Motley Fool,2025-12-10T06:25:00,,2025-12-10T23:53:08.063818,Yahoo Finance,Prediction: IonQ Stock Will Be Worth This Much By Year-End 2026 ,2025-12-10 06:25:00
CSCO,Cisco,2 Growth Stocks to Add to Your Roster and 1 We Avoid,https://finance.yahoo.com/news/2-growth-stocks-add-roster-043158746.html,StockStory,2025-12-09T23:31:58,,2025-12-10T23:53:08.063833,Yahoo Finance,2 Growth Stocks to Add to Your Roster and 1 We Avoid ,2025-12-09 23:31:58
CSCO,Cisco,"Bitcoin stays flat, small caps' rate-cut spike: Market takeaways",https://finance.yahoo.com/video/bitcoin-stays-flat-small-caps-230000741.html?.tsrc=rss,Yahoo Finance RSS,"Wed, 10 Dec 2025 23:00:00 +0000","Yahoo Finance Markets and Data Editor Jared Blikre joins Asking for a Trend host Josh Lipton to discuss three key takeaways from Wednesday's trading session: small-cap stocks (^RUT) spiking after the Federal Reserve rate cut, Cisco (CSCO) reaching its early 2000s all-time high, and an update on bitcoin (BTC-USD). To watch more expert insights and analysis on the latest market action, check out more Asking for a Trend.",2025-12-10T23:53:08.388145,Yahoo Finance,"Bitcoin stays flat, small caps' rate-cut spike: Market takeaways Yahoo Finance Markets and Data Editor Jared Blikre joins Asking for a Trend host Josh Lipton to discuss three key takeaways from Wednesday's trading session: small-cap stocks (^RUT) spiking after the Federal Reserve rate cut, Cisco (CSCO) reaching its early 2000s all-time high, and an update on bitcoin (BTC-USD). To watch more expert insights and analysis on the latest market action, check out more Asking for a Trend.",
CSCO,Cisco,Cisco Shares Finally Top Dot-Com Record After More Than 25 Years,https://finance.yahoo.com/news/cisco-shares-finally-top-dot-210520258.html?.tsrc=rss,Yahoo Finance RSS,"Wed, 10 Dec 2025 21:05:20 +0000","The stock’s March 27, 2000 high is viewed by many as the height of the dot-com bubble and marked the high-water mark for the tech-heavy Nasdaq 100 Index until late 2015. “Once you lose investor confidence through a painful selloff it can take years for investors to re-embrace.” The S&P 500 Index rose 0.7%, while the Nasdaq 100 Index gained 0.4%.",2025-12-10T23:53:08.388168,Yahoo Finance,"Cisco Shares Finally Top Dot-Com Record After More Than 25 Years The stock’s March 27, 2000 high is viewed by many as the height of the dot-com bubble and marked the high-water mark for the tech-heavy Nasdaq 100 Index until late 2015. “Once you lose investor confidence through a painful selloff it can take years for investors to re-embrace.” The S&P 500 Index rose 0.7%, while the Nasdaq 100 Index gained 0.4%.",
CSCO,Cisco,Oracle's $520 Billion Cloud Dream Faces a Debt Nightmare,https://finance.yahoo.com/news/oracles-520-billion-cloud-dream-172205961.html?.tsrc=rss,Yahoo Finance RSS,"Wed, 10 Dec 2025 17:22:05 +0000",AI hype gave Oracle its biggest rally in 30 years--now investors are bracing for a costly comedown,2025-12-10T23:53:08.388171,Yahoo Finance,Oracle's $520 Billion Cloud Dream Faces a Debt Nightmare AI hype gave Oracle its biggest rally in 30 years--now investors are bracing for a costly comedown,
CSCO,Cisco,Will NVIDIA (NVDA) Stock Hit $500 by 2030?,https://247wallst.com/investing/2025/12/10/will-nvidia-nvda-stock-hit-500-by-2030/?.tsrc=rss,Yahoo Finance RSS,"Wed, 10 Dec 2025 15:18:03 +0000","It’s the darling of the financial markets and the undisputed heavyweight champion among U.S.-based processor producers. Truly, NVIDIA (NASDAQ:NVDA) is roundly revered and to many traders, NVIDIA seems unstoppable. There are plenty of price predictions for NVDA stock, and some optimists can easily envision the share price hitting $500 by 2030. Is this too far-fetched, ... Will NVIDIA (NVDA) Stock Hit $500 by 2030?",2025-12-10T23:53:08.388175,Yahoo Finance,"Will NVIDIA (NVDA) Stock Hit $500 by 2030? It’s the darling of the financial markets and the undisputed heavyweight champion among U.S.-based processor producers. Truly, NVIDIA (NASDAQ:NVDA) is roundly revered and to many traders, NVIDIA seems unstoppable. There are plenty of price predictions for NVDA stock, and some optimists can easily envision the share price hitting $500 by 2030. Is this too far-fetched, ... Will NVIDIA (NVDA) Stock Hit $500 by 2030?",
CSCO,Cisco,"Iron Bow Technologies Wins ""Partner for Purpose Award for Crisis Response & Human Needs Solution"" in Cisco's 2025 Global Partner Innovation Challenge",https://finance.yahoo.com/news/iron-bow-technologies-wins-partner-150000418.html?.tsrc=rss,Yahoo Finance RSS,"Wed, 10 Dec 2025 15:00:00 +0000","Iron Bow Technologies has been named a winner of the Cisco 2025 Global Partner Innovation Challenge at Cisco Partner Summit. This is Cisco's eighth annual Global Partner Innovation Challenge, recognizing partners that deliver transformative solutions addressing urgent customer challenges and unlocking new business opportunities.",2025-12-10T23:53:08.388178,Yahoo Finance,"Iron Bow Technologies Wins ""Partner for Purpose Award for Crisis Response & Human Needs Solution"" in Cisco's 2025 Global Partner Innovation Challenge Iron Bow Technologies has been named a winner of the Cisco 2025 Global Partner Innovation Challenge at Cisco Partner Summit. This is Cisco's eighth annual Global Partner Innovation Challenge, recognizing partners that deliver transformative solutions addressing urgent customer challenges and unlocking new business opportunities.",
CSCO,Cisco,Cyber Resilience for All: How Cisco and NIIT Foundation Are Securing India's Digital Future,https://finance.yahoo.com/news/cyber-resilience-cisco-niit-foundation-141500771.html?.tsrc=rss,Yahoo Finance RSS,"Wed, 10 Dec 2025 14:15:00 +0000","By Tarun Anthony NORTHAMPTON, MA / ACCESS Newswire / December 10, 2025 / As India undergoes rapid digital transformation, the opportunities are immense - but so are the risks. Cybercrime losses exceeded ₹1,750 crore in the first four months of 2024 ...",2025-12-10T23:53:08.388182,Yahoo Finance,"Cyber Resilience for All: How Cisco and NIIT Foundation Are Securing India's Digital Future By Tarun Anthony NORTHAMPTON, MA / ACCESS Newswire / December 10, 2025 / As India undergoes rapid digital transformation, the opportunities are immense - but so are the risks. Cybercrime losses exceeded ₹1,750 crore in the first four months of 2024 ...",
