ticker,company,title,url,source,published_at,snippet,scraped_at,platform,text_for_analysis,published_date
AAPL,Apple Inc.,"Did Apple’s Executive Overhaul Around AI, Regulation and ESG Just Shift Its (AAPL) Investment Narrative?",https://finance.yahoo.com/news/did-apple-executive-overhaul-around-231425875.html,Simply Wall St.,2025-12-10T18:14:25,,2025-12-10T23:52:38.999316,Yahoo Finance,"Did Apple’s Executive Overhaul Around AI, Regulation and ESG Just Shift Its (AAPL) Investment Narrative? ",2025-12-10 18:14:25
AAPL,Apple Inc.,"The Dealmaking 3 – GameChangers, Track Titan, Surging Sports-Tech Industry",https://finance.yahoo.com/m/3eb44b04-a32d-36e0-8cee-e857da7e75ab/the-dealmaking-3-%E2%80%93.html,CorpGov.com,2025-12-10T17:58:39,,2025-12-10T23:52:38.999334,Yahoo Finance,"The Dealmaking 3 – GameChangers, Track Titan, Surging Sports-Tech Industry ",2025-12-10 17:58:39
AAPL,Apple Inc.,Why Microsoft Stock Tumbled Today,https://finance.yahoo.com/m/c99720d0-aabf-33c7-85f3-56d09ab57b91/why-microsoft-stock-tumbled.html,Motley Fool,2025-12-10T16:33:57,,2025-12-10T23:52:38.999358,Yahoo Finance,Why Microsoft Stock Tumbled Today ,2025-12-10 16:33:57
AAPL,Apple Inc.,QQQ vs. VGT: What's the Better Tech ETF Going Into 2026?,https://finance.yahoo.com/m/13e2994b-121d-3077-acc6-8dc10fb023a2/qqq-vs.-vgt%3A-what%27s-the.html,Motley Fool,2025-12-10T15:25:00,,2025-12-10T23:52:38.999370,Yahoo Finance,QQQ vs. VGT: What's the Better Tech ETF Going Into 2026? ,2025-12-10 15:25:00
AAPL,Apple Inc.,Evercore Analysts Are Pounding the Table on Apple Stock Ahead of a ‘Sizable Catalyst’ Coming in 2026,https://finance.yahoo.com/m/20ce1dc6-0884-32ec-a20b-0dc19cff105b/evercore-analysts-are.html,Barchart,2025-12-10T15:17:13,,2025-12-10T23:52:38.999383,Yahoo Finance,Evercore Analysts Are Pounding the Table on Apple Stock Ahead of a ‘Sizable Catalyst’ Coming in 2026 ,2025-12-10 15:17:13
AAPL,Apple Inc.,"Jeff Williams, who retired from Apple after 27 years less than a month ago, just got called up by Disney to join its board of directors",https://finance.yahoo.com/news/jeff-williams-retired-apple-27-192406268.html,Fortune,2025-12-10T14:24:06,,2025-12-10T23:52:38.999394,Yahoo Finance,"Jeff Williams, who retired from Apple after 27 years less than a month ago, just got called up by Disney to join its board of directors ",2025-12-10 14:24:06
AAPL,Apple Inc.,Apple’s Cook Presses Congress Over Child Online Safety Bill,https://finance.yahoo.com/news/apple-cook-presses-us-lawmakers-175644735.html,Bloomberg,2025-12-10T13:52:02,,2025-12-10T23:52:38.999405,Yahoo Finance,Apple’s Cook Presses Congress Over Child Online Safety Bill ,2025-12-10 13:52:02
AAPL,Apple Inc.,"Forget Monthly Dividends, These 5 ETFs Pay Investors Every Week",https://finance.yahoo.com/m/06520e0c-21ae-385c-808c-9cd85771546e/forget-monthly-dividends%2C.html,24/7 Wall St.,2025-12-10T13:26:42,,2025-12-10T23:52:38.999416,Yahoo Finance,"Forget Monthly Dividends, These 5 ETFs Pay Investors Every Week ",2025-12-10 13:26:42
AAPL,Apple Inc.,"Apple's Tim Cook reportedly on Capitol Hill, Oracle earnings watch",https://finance.yahoo.com/video/apples-tim-cook-reportedly-capitol-181349594.html,Yahoo Finance Video,2025-12-10T13:13:49,,2025-12-10T23:52:38.999427,Yahoo Finance,"Apple's Tim Cook reportedly on Capitol Hill, Oracle earnings watch ",2025-12-10 13:13:49
AAPL,Apple Inc.,"Did Apple’s Executive Overhaul Around AI, Regulation and ESG Just Shift Its (AAPL) Investment Narrative?",https://finance.yahoo.com/news/did-apple-executive-overhaul-around-231425875.html?.tsrc=rss,Yahoo Finance RSS,"Wed, 10 Dec 2025 23:14:25 +0000","In recent days, Apple has outlined a sweeping leadership transition, including the upcoming retirement of long‑time general counsel Kate Adams, the planned arrival of former Meta chief legal officer Jennifer Newstead to oversee a merged Legal and Government Affairs group in 2026, and the future retirement of AI head John Giannandrea as he shifts into an advisory role. These moves, alongside Lisa Jackson’s planned departure after overseeing a more than 60% cut in Apple’s emissions since 2015...",2025-12-10T23:52:39.320031,Yahoo Finance,"Did Apple’s Executive Overhaul Around AI, Regulation and ESG Just Shift Its (AAPL) Investment Narrative? In recent days, Apple has outlined a sweeping leadership transition, including the upcoming retirement of long‑time general counsel Kate Adams, the planned arrival of former Meta chief legal officer Jennifer Newstead to oversee a merged Legal and Government Affairs group in 2026, and the future retirement of AI head John Giannandrea as he shifts into an advisory role. These moves, alongside Lisa Jackson’s planned departure after overseeing a more than 60% cut in Apple’s emissions since 2015...",
AAPL,Apple Inc.,Why Microsoft Stock Tumbled Today,https://www.fool.com/investing/2025/12/10/why-microsoft-stock-tumbled-today/?.tsrc=rss,Yahoo Finance RSS,"Wed, 10 Dec 2025 21:33:57 +0000","For hardly the first time in its history, the company has come under the scrutiny of legal officials.",2025-12-10T23:52:39.320046,Yahoo Finance,"Why Microsoft Stock Tumbled Today For hardly the first time in its history, the company has come under the scrutiny of legal officials.",
AAPL,Apple Inc.,QQQ vs. VGT: What's the Better Tech ETF Going Into 2026?,https://www.fool.com/investing/2025/12/10/qqq-vs-vgt-whats-the-better-tech-etf-going-into-20/?.tsrc=rss,Yahoo Finance RSS,"Wed, 10 Dec 2025 20:25:00 +0000",Both ETFs approach investing in the tech sector in different ways.,2025-12-10T23:52:39.320049,Yahoo Finance,QQQ vs. VGT: What's the Better Tech ETF Going Into 2026? Both ETFs approach investing in the tech sector in different ways.,
AAPL,Apple Inc.,Evercore Analysts Are Pounding the Table on Apple Stock Ahead of a ‘Sizable Catalyst’ Coming in 2026,https://www.barchart.com/story/news/36558355/evercore-analysts-are-pounding-the-table-on-apple-stock-ahead-of-a-sizable-catalyst-coming-in-2026?.tsrc=rss,Yahoo Finance RSS,"Wed, 10 Dec 2025 20:17:13 +0000",Investors who buy AAPL stock based on Evercore's call may be disappointed.,2025-12-10T23:52:39.320051,Yahoo Finance,Evercore Analysts Are Pounding the Table on Apple Stock Ahead of a ‘Sizable Catalyst’ Coming in 2026 Investors who buy AAPL stock based on Evercore's call may be disappointed.,
AAPL,Apple Inc.,"Jeff Williams, who retired from Apple after 27 years less than a month ago, just got called up by Disney to join its board of directors",https://finance.yahoo.com/news/jeff-williams-retired-apple-27-192406268.html?.tsrc=rss,Yahoo Finance RSS,"Wed, 10 Dec 2025 19:24:06 +0000",Jeff Williams' track record aligns closely with Disney's priorities for the future.,2025-12-10T23:52:39.320054,Yahoo Finance,"Jeff Williams, who retired from Apple after 27 years less than a month ago, just got called up by Disney to join its board of directors Jeff Williams' track record aligns closely with Disney's priorities for the future.",
AAPL,Apple Inc.,Apple’s Cook Presses Congress Over Child Online Safety Bill,https://finance.yahoo.com/news/apple-cook-presses-us-lawmakers-175644735.html?.tsrc=rss,Yahoo Finance RSS,"Wed, 10 Dec 2025 18:52:02 +0000","Apple has raised concerns about the App Store Accountability Act, which would require app stores to verify the ages of users in order to determine whether minors are using potentially harmful apps. The House Energy and Commerce Committee is scheduled to consider the bill on Thursday morning.",2025-12-10T23:52:39.320059,Yahoo Finance,"Apple’s Cook Presses Congress Over Child Online Safety Bill Apple has raised concerns about the App Store Accountability Act, which would require app stores to verify the ages of users in order to determine whether minors are using potentially harmful apps. The House Energy and Commerce Committee is scheduled to consider the bill on Thursday morning.",
AAPL,Apple Inc.,"Forget Monthly Dividends, These 5 ETFs Pay Investors Every Week",https://247wallst.com/investing/2025/06/19/forget-monthly-dividends-these-5-etfs-pay-investors-every-week/?.tsrc=rss,Yahoo Finance RSS,"Wed, 10 Dec 2025 18:26:42 +0000","For quite some time, dividends were paid monthly, quarterly, annually, or semi-annually. Now, you can collect dividends every single week. That’s great news for investors looking for regular income, particularly for retirees who need consistent cash flow coming in. Look at the AAPL WeeklyPay ETF (BATS: AAPW), for example. With an expense ratio of 0.99%, ... Forget Monthly Dividends, These 5 ETFs Pay Investors Every Week",2025-12-10T23:52:39.320062,Yahoo Finance,"Forget Monthly Dividends, These 5 ETFs Pay Investors Every Week For quite some time, dividends were paid monthly, quarterly, annually, or semi-annually. Now, you can collect dividends every single week. That’s great news for investors looking for regular income, particularly for retirees who need consistent cash flow coming in. Look at the AAPL WeeklyPay ETF (BATS: AAPW), for example. With an expense ratio of 0.99%, ... Forget Monthly Dividends, These 5 ETFs Pay Investors Every Week",
AAPL,Apple Inc.,"Apple's Tim Cook reportedly on Capitol Hill, Oracle earnings watch",https://finance.yahoo.com/video/apples-tim-cook-reportedly-capitol-181349594.html?.tsrc=rss,Yahoo Finance RSS,"Wed, 10 Dec 2025 18:13:49 +0000","Yahoo Finance Senior Producer John Hyland examines some of the top stories on Wall Street as part of Yahoo Finance's Market Minute. As investors wait for the Federal Reserve's interest rate decision, Oracle (ORCL) is in focus ahead of its earnings report after the closing bell. Meanwhile, Apple (AAPL) CEO Tim Cook is reportedly on Capitol Hill in Washington, D.C., talking to lawmakers about tech safeguards to protect children, according to reporting from Punchbowl. Stay up to date on the latest market action, minute-by-minute, with Yahoo Finance's Market Minute.",2025-12-10T23:52:39.320064,Yahoo Finance,"Apple's Tim Cook reportedly on Capitol Hill, Oracle earnings watch Yahoo Finance Senior Producer John Hyland examines some of the top stories on Wall Street as part of Yahoo Finance's Market Minute. As investors wait for the Federal Reserve's interest rate decision, Oracle (ORCL) is in focus ahead of its earnings report after the closing bell. Meanwhile, Apple (AAPL) CEO Tim Cook is reportedly on Capitol Hill in Washington, D.C., talking to lawmakers about tech safeguards to protect children, according to reporting from Punchbowl. Stay up to date on the latest market action, minute-by-minute, with Yahoo Finance's Market Minute.",
AAPL,Apple Inc.,"Euronet Worldwide (EEFT) Stock Is Up, What You Need To Know",https://finance.yahoo.com/news/euronet-worldwide-eeft-stock-know-180558764.html?.tsrc=rss,Yahoo Finance RSS,"Wed, 10 Dec 2025 18:05:58 +0000","Shares of financial technology provider Euronet Worldwide (NASDAQ:EEFT) jumped 2.6% in the afternoon session after the company made a push into credit card issuing and flexible payment products with its acquisition of CoreCard. The deal combined Euronet's established payments infrastructure with CoreCard's modern, API-driven processing platform. CoreCard served major clients including Goldman Sachs, American Express, and Apple, notably handling billions of transactions for the highly successful",2025-12-10T23:52:39.320067,Yahoo Finance,"Euronet Worldwide (EEFT) Stock Is Up, What You Need To Know Shares of financial technology provider Euronet Worldwide (NASDAQ:EEFT) jumped 2.6% in the afternoon session after the company made a push into credit card issuing and flexible payment products with its acquisition of CoreCard. The deal combined Euronet's established payments infrastructure with CoreCard's modern, API-driven processing platform. CoreCard served major clients including Goldman Sachs, American Express, and Apple, notably handling billions of transactions for the highly successful",
AAPL,Apple Inc.,Could Meta Stock Skyrocket in 2026 If Mark Zuckerberg Declares Another ‘Year of Efficiency’?,https://www.barchart.com/story/news/36555605/could-meta-stock-skyrocket-in-2026-if-mark-zuckerberg-declares-another-year-of-efficiency?.tsrc=rss,Yahoo Finance RSS,"Wed, 10 Dec 2025 17:24:47 +0000","Meta is looking to cut its metaverse spending by as much as 30% next year. Could it work wonders for the stock as the ""year of efficiency"" did in 2023?",2025-12-10T23:52:39.320070,Yahoo Finance,"Could Meta Stock Skyrocket in 2026 If Mark Zuckerberg Declares Another ‘Year of Efficiency’? Meta is looking to cut its metaverse spending by as much as 30% next year. Could it work wonders for the stock as the ""year of efficiency"" did in 2023?",
AAPL,Apple Inc.,"Talk of an AI bubble is just 'ridiculous,' this strategist says",https://finance.yahoo.com/video/talk-ai-bubble-just-ridiculous-171039241.html?.tsrc=rss,Yahoo Finance RSS,"Wed, 10 Dec 2025 17:10:39 +0000","Investors are still going back and forth over whether there is an AI bubble surrounding markets (^DJI, ^IXIC, ^GSPC) or whether it is going to pop soon. One Wall Street analyst finds the chatter over the existence of an AI bubble ""ridiculous."" Humilis Investment Strategies CEO and Chief Investment Officer Brian Belski sits down with Market Catalysts host Julie Hyman to explain his thoughts on the AI trade, dynamic changes since the Dot-Com Bubble of the 1990s, and his view on the Magnificent Seven tech stocks. To watch more expert insights and analysis on the latest market action, check out more Market Catalysts.",2025-12-10T23:52:39.320072,Yahoo Finance,"Talk of an AI bubble is just 'ridiculous,' this strategist says Investors are still going back and forth over whether there is an AI bubble surrounding markets (^DJI, ^IXIC, ^GSPC) or whether it is going to pop soon. One Wall Street analyst finds the chatter over the existence of an AI bubble ""ridiculous."" Humilis Investment Strategies CEO and Chief Investment Officer Brian Belski sits down with Market Catalysts host Julie Hyman to explain his thoughts on the AI trade, dynamic changes since the Dot-Com Bubble of the 1990s, and his view on the Magnificent Seven tech stocks. To watch more expert insights and analysis on the latest market action, check out more Market Catalysts.",
AAPL,Apple Inc.,Resideo Technologies Inc. (REZI) Unveils Honeywell Home X8S Smart Thermostat with Live Video Streaming Capability,https://finance.yahoo.com/news/resideo-technologies-inc-rezi-unveils-162926733.html?.tsrc=rss,Yahoo Finance RSS,"Wed, 10 Dec 2025 16:29:26 +0000","Resideo Technologies Inc. (NYSE:REZI) is one of the best industrial stocks to buy according to Wall Street analysts. Resideo Technologies Inc. (NYSE:REZI) holds a consensus Moderate Buy rating with a $44 average target, implying 30.45% upside potential. On December 3, Resideo Technologies Inc. unveiled a new X8S thermostat designed to enhance live video streaming from […]",2025-12-10T23:52:39.320075,Yahoo Finance,"Resideo Technologies Inc. (REZI) Unveils Honeywell Home X8S Smart Thermostat with Live Video Streaming Capability Resideo Technologies Inc. (NYSE:REZI) is one of the best industrial stocks to buy according to Wall Street analysts. Resideo Technologies Inc. (NYSE:REZI) holds a consensus Moderate Buy rating with a $44 average target, implying 30.45% upside potential. On December 3, Resideo Technologies Inc. unveiled a new X8S thermostat designed to enhance live video streaming from […]",
AAPL,Apple Inc.,Magnificent Seven Stocks: Nvidia Slides; Tesla Offers New Buy Point,https://finance.yahoo.com/m/4205eaa9-f620-3a0b-a81a-0e82c7c9fd0b/magnificent-seven-stocks%3A.html?.tsrc=rss,Yahoo Finance RSS,"Wed, 10 Dec 2025 16:11:42 +0000","Magnificent Seven stocks, including Nvidia and Tesla, are among the best to watch in today's stock market.",2025-12-10T23:52:39.320078,Yahoo Finance,"Magnificent Seven Stocks: Nvidia Slides; Tesla Offers New Buy Point Magnificent Seven stocks, including Nvidia and Tesla, are among the best to watch in today's stock market.",
AAPL,Apple Inc.,Apple's Foldable iPhone Expected to Land Well with Consumers,https://finance.yahoo.com/news/apples-foldable-iphone-expected-land-155153304.html?.tsrc=rss,Yahoo Finance RSS,"Wed, 10 Dec 2025 15:51:53 +0000",Analysts say Apple's long-awaited entry into foldables could reshape the category.,2025-12-10T23:52:39.320080,Yahoo Finance,Apple's Foldable iPhone Expected to Land Well with Consumers Analysts say Apple's long-awaited entry into foldables could reshape the category.,
AAPL,Apple Inc.,How Big Tech's AI build-out is 'mostly' a private credit story,https://finance.yahoo.com/video/big-techs-ai-build-mostly-153717614.html?.tsrc=rss,Yahoo Finance RSS,"Wed, 10 Dec 2025 15:37:17 +0000","Big Tech companies are spending trillions to build out data centers, and the $40 trillion private credit market is supporting that build-out in a way public investors may not realize. As part of Yahoo Finance's exclusive coverage with executives at Apollo Global (APO), Yahoo Finance Executive Editor Brian Sozzi sits down with Apollo Global Management's co-head of corporate credit, John Cortese, to discuss how artificial intelligence (AI) infrastructure is a private credit story and to explain what investors get wrong about the space. To watch more expert insights and analysis on the latest market action, check out more Opening Bid. Note: Apollo Global Management is the parent company of Yahoo Finance.",2025-12-10T23:52:39.320083,Yahoo Finance,"How Big Tech's AI build-out is 'mostly' a private credit story Big Tech companies are spending trillions to build out data centers, and the $40 trillion private credit market is supporting that build-out in a way public investors may not realize. As part of Yahoo Finance's exclusive coverage with executives at Apollo Global (APO), Yahoo Finance Executive Editor Brian Sozzi sits down with Apollo Global Management's co-head of corporate credit, John Cortese, to discuss how artificial intelligence (AI) infrastructure is a private credit story and to explain what investors get wrong about the space. To watch more expert insights and analysis on the latest market action, check out more Opening Bid. Note: Apollo Global Management is the parent company of Yahoo Finance.",
AAPL,Apple Inc.,"TSMC: The Foundry Behind Nvidia, AMD and Apple Is Setting AI On Fire",https://finance.yahoo.com/news/why-tsmc-powering-next-wave-113102409.html?.tsrc=rss,Yahoo Finance RSS,"Wed, 10 Dec 2025 15:22:46 +0000",TSMC Poised to Capture AI Chip Demand as Data-center Spending Climbs,2025-12-10T23:52:39.320086,Yahoo Finance,"TSMC: The Foundry Behind Nvidia, AMD and Apple Is Setting AI On Fire TSMC Poised to Capture AI Chip Demand as Data-center Spending Climbs",
AAPL,Apple Inc.,QYLD Turns Mag 7 Tech Stocks Into an 11% Dividend Yield,https://247wallst.com/investing/2025/12/10/qyld-turns-mag-7-tech-stocks-into-an-11-dividend-yield/?.tsrc=rss,Yahoo Finance RSS,"Wed, 10 Dec 2025 14:48:19 +0000","Global X Nasdaq 100 Covered Call ETF (NASDAQ:QYLD) transforms the Nasdaq-100’s top technology stocks into an 11% monthly dividend by selling covered call options against its holdings. Unlike traditional dividend ETFs, QYLD generates income exclusively through option premiums. The fund sells near-the-money call options on its entire portfolio each month, collecting premiums from buyers who ... QYLD Turns Mag 7 Tech Stocks Into an 11% Dividend Yield",2025-12-10T23:52:39.320088,Yahoo Finance,"QYLD Turns Mag 7 Tech Stocks Into an 11% Dividend Yield Global X Nasdaq 100 Covered Call ETF (NASDAQ:QYLD) transforms the Nasdaq-100’s top technology stocks into an 11% monthly dividend by selling covered call options against its holdings. Unlike traditional dividend ETFs, QYLD generates income exclusively through option premiums. The fund sells near-the-money call options on its entire portfolio each month, collecting premiums from buyers who ... QYLD Turns Mag 7 Tech Stocks Into an 11% Dividend Yield",
AAPL,Apple Inc.,"Sales of foreign-branded phones in China up 13.0% in October, data shows",https://finance.yahoo.com/news/sales-foreign-branded-phones-china-142749797.html?.tsrc=rss,Yahoo Finance RSS,"Wed, 10 Dec 2025 14:27:49 +0000","Sales of foreign-branded phones, ​including Apple Inc's ‌iPhone, increased 13.0% year-on-year in ‌China in October, according to Reuters calculations based on data released ⁠on Wednesday ‌by a government-affiliated research firm. The shipments ‍of foreign-branded phones had rose to 7.027 million units ​in October, from 6.216 ‌million handsets the same month a year earlier, calculations based on the data from the ⁠China Academy of ​Information and ​Communications Technology showed. Overall phone sales in China ‍were ⁠up 8.7% to 32.267 million units in October, ⁠according to the data.",2025-12-10T23:52:39.320091,Yahoo Finance,"Sales of foreign-branded phones in China up 13.0% in October, data shows Sales of foreign-branded phones, ​including Apple Inc's ‌iPhone, increased 13.0% year-on-year in ‌China in October, according to Reuters calculations based on data released ⁠on Wednesday ‌by a government-affiliated research firm. The shipments ‍of foreign-branded phones had rose to 7.027 million units ​in October, from 6.216 ‌million handsets the same month a year earlier, calculations based on the data from the ⁠China Academy of ​Information and ​Communications Technology showed. Overall phone sales in China ‍were ⁠up 8.7% to 32.267 million units in October, ⁠according to the data.",
AAPL,Apple Inc.,"Kettle Closes a Landmark Year of Momentum, Innovation and Industry Recognition",https://finance.yahoo.com/news/kettle-closes-landmark-momentum-innovation-140100363.html?.tsrc=rss,Yahoo Finance RSS,"Wed, 10 Dec 2025 14:01:00 +0000","Kettle, the digital-first creative agency partnering with brands like Apple, T-Mobile and Warby Parker, is closing out 2025 with extraordinary momentum and a clear vision for its next chapter. The year was defined by exciting new projects, deepened client partnerships and most recently, a significant industry honor: CEO Lauren Kushner has been named The Drum's Agency Leader of the Year.",2025-12-10T23:52:39.320094,Yahoo Finance,"Kettle Closes a Landmark Year of Momentum, Innovation and Industry Recognition Kettle, the digital-first creative agency partnering with brands like Apple, T-Mobile and Warby Parker, is closing out 2025 with extraordinary momentum and a clear vision for its next chapter. The year was defined by exciting new projects, deepened client partnerships and most recently, a significant industry honor: CEO Lauren Kushner has been named The Drum's Agency Leader of the Year.",
ABBV,AbbVie,This Dividend Pharma Giant Yielding 2.9% Just Got a Big Vote of Confidence,https://finance.yahoo.com/m/91025a99-5a1b-3a28-bc7e-52d2f2512d54/this-dividend-pharma-giant.html,24/7 Wall St.,2025-12-10T13:19:49,,2025-12-10T23:52:59.427317,Yahoo Finance,This Dividend Pharma Giant Yielding 2.9% Just Got a Big Vote of Confidence ,2025-12-10 13:19:49
ABBV,AbbVie,ASH 2025: AbbVie and Genmab’s Epkinly sets new standard in second-line FL,https://finance.yahoo.com/m/9e96060a-811d-3c65-9d5c-a1c762d5e732/ash-2025%3A-abbvie-and-genmab%E2%80%99s.html,Clinical Trials Arena,2025-12-10T12:40:42,,2025-12-10T23:52:59.427331,Yahoo Finance,ASH 2025: AbbVie and Genmab’s Epkinly sets new standard in second-line FL ,2025-12-10 12:40:42
ABBV,AbbVie,DLocal And 2 Other Stocks That May Be Priced Below Intrinsic Value,https://finance.yahoo.com/news/dlocal-2-other-stocks-may-173805768.html,Simply Wall St.,2025-12-10T12:38:05,,2025-12-10T23:52:59.427338,Yahoo Finance,DLocal And 2 Other Stocks That May Be Priced Below Intrinsic Value ,2025-12-10 12:38:05
ABBV,AbbVie,"At A 8% Yield, Global X SuperDividend SDIV) Is One Of The Most Impressive High Income ETFs Today",https://finance.yahoo.com/m/e7cf1e82-fc4d-3ff6-a249-a933631fc115/at-a-8%25-yield%2C-global-x.html,24/7 Wall St.,2025-12-10T11:13:14,,2025-12-10T23:52:59.427344,Yahoo Finance,"At A 8% Yield, Global X SuperDividend SDIV) Is One Of The Most Impressive High Income ETFs Today ",2025-12-10 11:13:14
ABBV,AbbVie,"Amazon initiated, GE Vernova upgraded: Wall Street's top analyst calls",https://finance.yahoo.com/news/amazon-initiated-ge-vernova-upgraded-144000835.html,The Fly,2025-12-10T09:40:00,,2025-12-10T23:52:59.427350,Yahoo Finance,"Amazon initiated, GE Vernova upgraded: Wall Street's top analyst calls ",2025-12-10 09:40:00
ABBV,AbbVie,"Here Are Wednesday’s Top Wall Street Analyst Research Calls: AbbVie, Amazon.com, Biogen, EchoStar, Ferrari, GE Vernova, PepsiCo, Take-Two Interactive, and More",https://finance.yahoo.com/m/f061aa8a-a13b-3b17-beb0-1784aef9ebd4/here-are-wednesday%E2%80%99s-top-wall.html,24/7 Wall St.,2025-12-10T09:09:21,,2025-12-10T23:52:59.427358,Yahoo Finance,"Here Are Wednesday’s Top Wall Street Analyst Research Calls: AbbVie, Amazon.com, Biogen, EchoStar, Ferrari, GE Vernova, PepsiCo, Take-Two Interactive, and More ",2025-12-10 09:09:21
ABBV,AbbVie,HSBC highlights one pharma stock to buy and one to sell for 2026,https://finance.yahoo.com/news/hsbc-highlights-one-pharma-stock-133658900.html,Investing.com,2025-12-10T08:36:58,,2025-12-10T23:52:59.427364,Yahoo Finance,HSBC highlights one pharma stock to buy and one to sell for 2026 ,2025-12-10 08:36:58
ABBV,AbbVie,3 Prominent Stocks Estimated To Be Trading At Up To 38.4% Below Intrinsic Value,https://finance.yahoo.com/news/3-prominent-stocks-estimated-trading-113758642.html,Simply Wall St.,2025-12-10T06:37:58,,2025-12-10T23:52:59.427371,Yahoo Finance,3 Prominent Stocks Estimated To Be Trading At Up To 38.4% Below Intrinsic Value ,2025-12-10 06:37:58
